start,end,Fecha,Sede,Genero,Edad,Notas,tecnica_grupo,Tecnica,Descripción,Tecnica_lengua,Lengua,Lengua_nota,Estado,Municipio,Localidad,Manufactura,Mano,Pedal,Telar,Mixta,Otra,Tejido,Telar_pedal,Manufactura_especifique,Tenido,Tipo_tenido,Plantas,Minerales,Animales,Otro,Tenido_especifique,Temporalidad,Historia,Materiales,Aprendizaje,Madre,Abuela,Tia,Hermana,Cunada,Instructora,Aprendi_otro,Padre,Aprendizaje_especifique,Ensenanza,No_ensenado,Hijas,Nietos,Sobrinos,Pareja,Estudiantes,Enseno_otra,Hijos,Ensenar_especifique,pr1,pr8,pr2,pr4,pr10,pr9,pr3,pr5,pr7,pr6,c6,cm7,c3,cm3,c7,cm5,c4,cm4,c1,cm1,c2,cm2,c8,cm8,c5,cm6,Significado,S1,S2,S3,S4,S5,pic,video,index,concat_id,_index
28/11/2025,28/11/2025,28/11/2025,CDMX,mujer,38,,,Telar de cintura,telar de cintura,telar de cintura,,nahuatl,Morelos,Hueyapan,Hueyapan Morelos,otra,0,0,1,0,0,0,0,,Sí,te_ido_con_plantas__ejem__muicle__peric_ te_ido_con_sales_y_minerales__ejem__alum te_ido_con_con_insectos_y_animales__ejem,1,1,1,0,"Añil,cochinilla, plantas ,flores ,cortezas ,,alumbre",es_una_t_cnica_antigua,era para la vestimenta cotidiana,"lana de borrego,tintes naturales",madre,1,0,0,0,0,0,0,0,,si__a_otra_persona,0,0,0,0,0,0,0,1,,gaban,reboso,quexquemetl,capas,morrales,llaveros,caminos,rusnas,chaleco,colchas,eventos culturales,,,,,,,,,,,,,,,,No,la vestimenta cotidiana de nuestros ancestros,,,,,https://kf.kobotoolbox.org/api/v2/assets/aXi3htSMn4QfEDCtR4ZVnV/data/617346496/attachments/attmgEwucH5xrdv8jzF8KwUa/,,138,138-CDMX,127
28/11/2025,28/11/2025,28/11/2025,CDMX,mujer,64,,,Telar de cintura,Telar de cintura,Njnoo',,Amuzga,Oaxaca,San Pedro Amuzgos,,otra,0,0,1,0,0,0,0,,Sí,te_ido_con_plantas__ejem__muicle__peric_,1,0,0,0,,es_una_t_cnica_nueva,Con el tinte natural se da otro realce para el telar,"Hilo 162, hilo vela y algodón Coyuche y verde y blanco",madre abuela,1,0,1,0,0,0,0,0,,s__a_mis_hijas_o_hijos a_hijos s__a_mis_nietas_o_nietos,0,1,1,1,0,0,0,0,,Traje de gala,Huipil,Blusa,Bluson,,,,,,,Fiesta del patrón del pueblo y bodas,,Pedidos especiales,,Ocasiones especiales,,,,,,,,,,,,Sí,Representa lo tradicional de los ancestros,,,,,https://kf.kobotoolbox.org/api/v2/assets/aXi3htSMn4QfEDCtR4ZVnV/data/617345522/attachments/att6ZS9UgfBiahTHgxT7FYWu/,,130,130-CDMX,118
28/11/2025,28/11/2025,28/11/2025,CDMX,mujer,65,,,Telar de cintura,Tradicional  rustico antgua y punto de cruz telar de cintura endiferentes tecnicas,Xatalakgatsaman chu xakulus na chuna xatipakgatsin chuca tahlawan tipakgatsin,Totonaco,Totonaco,Veracruz de Ignacio de la Llave,Papantla,,se_realiza_a_mano se_realiza_con_tejido_a_mano otra,1,0,1,0,0,1,0,,Sí,te_ido_con_plantas__ejem__muicle__peric_ te_ido_con_sales_y_minerales__ejem__alum te_ido_con_con_insectos_y_animales__ejem,1,1,1,0,,es_una_t_cnica_antigua,Que vienen de nuestros abuelos,"Hilo de algodón,  algodón hilado a mano y comercial, agujas,tijeras,aros y ganchos.",t_a otra,0,0,0,1,0,0,0,1,Escuela,a_hijos si__a_otra_persona,0,0,1,0,0,0,0,1,"Comunidades diferentes, cursos en el extranjero",Blusas,Faldas,Trajes ceremoniales,Camisas,,,,,,,Bodas,,Ceremonias,,Rituales,,Danzas,,Indumentaria totonaca,,,,,,,,Sí,,,,,,https://kf.kobotoolbox.org/api/v2/assets/aXi3htSMn4QfEDCtR4ZVnV/data/617345591/attachments/attgjMc9JN8nsZXQZyJ8dDc5/,,131,131-CDMX,119
28/11/2025,28/11/2025,28/11/2025,CDMX,mujer,59,genisnoelia@gmail.com,,Punto de Cruz,Punto de cruz,,Náhuatl,,Morelos,Hueyapan,Morelos,se_realiza_a_mano,1,0,0,0,0,0,0,,Sí,te_ido_con_plantas__ejem__muicle__peric_,1,0,0,0,,es_una_t_cnica_antigua,,Aguja hilos de lana teñidas,madre,1,0,0,0,0,0,0,0,,s__a_mis_hijas_o_hijos,0,1,0,0,0,0,0,0,,,,,,,,,,,,Rebozos,,Gabanes,,Monedero,,,,,,,,,,,,No,,,,,,,,132,132-CDMX,120
28/11/2025,28/11/2025,28/11/2025,CDMX,mujer,48,,,Bordado tradicional,Bordado tradicional,,,,Puebla,,,se_realiza_a_mano,1,0,0,0,0,0,0,,No,,0,0,0,0,,,,,,0,0,0,0,0,0,0,0,,s__a_mis_hijas_o_hijos,0,1,0,0,0,0,0,0,,,,,,,,,,,,,,,,,,,,,,,,,,,,No,,,,,,,,133,133-CDMX,121
28/11/2025,28/11/2025,28/11/2025,CDMX,mujer,33,,,Punto de Cruz,Punto de cruz,Wixarika xuiyaya,,Wixarika,Durango,Mezquital,Brasiles,se_realiza_a_mano,1,0,0,0,0,0,0,,No,,0,0,0,0,,es_una_t_cnica_antigua,Usos y costumbres,"Manta de algodón,estambre de acrilan",madre,1,0,0,0,0,0,0,0,,no_la_he_ense_ado s__a_mis_hijas_o_hijos,1,1,0,0,0,0,0,0,,Falda,Blusas,Morrales,,,,,,,,En fiesta tradicional,Fiesta del tambor,Fiesta del elote,,,,,,,,,,,,,,Sí,Lo que se plasma en las prendas,Animales que se ocupa en las ceremonias,El jikuri,,,https://kf.kobotoolbox.org/api/v2/assets/aXi3htSMn4QfEDCtR4ZVnV/data/617346033/attachments/attWWo7b3twUY2QfoiHaqzQp/,,134,134-CDMX,122
28/11/2025,28/11/2025,28/11/2025,CDMX,mujer,57,,,Bordado de dos agujas,Bordado de dos haujas,Bordado  masahua,,Masahua,,,Villa de Allende,se_realiza_a_mano,1,0,0,0,0,0,0,,Sí,te_ido_con_plantas__ejem__muicle__peric_,1,0,0,0,Flores nogales hojas verdes  sal y alumbre,es_una_t_cnica_antigua,enseñanzazde nuestros ansestros legados que no queremos que se pierdan,Lana ilada hilo de algodón y tela en lienzo de lana y manta,abuela,0,0,1,0,0,0,0,0,Cuñada,s__a_mis_hijas_o_hijos,0,1,0,0,0,0,0,0,A mí nuera,"En vestido ,blusas  ,sacos o ropa de vestir",,,,,,,,,,En ceremonias religiosas de la comunidad,,Eventos cómo original,,Otras ceremonia de  eventos de artesanías,,,,,,,,,,,,Sí,Nuestra artesania,Origen,Tradición,Legado,Creatividad,,,135,135-CDMX,123
28/11/2025,28/11/2025,28/11/2025,CDMX,mujer,42,,,Empuntado,Empuntado,No aplica,,Español,México,Tenancingo,Acatzingo,se_realiza_a_mano,1,0,0,0,0,0,0,,No,,0,0,0,0,,es_una_t_cnica_antigua,No,El lienzo k es el revozo,madre,1,0,0,0,0,0,0,0,,s__a_mis_hijas_o_hijos,0,1,0,0,0,0,0,0,,Guipil,Quexquemetl,Vestidos,Camisas,Blusas,Joyería,,,,,En las fiestas del pueblo,,Para ir a misa,,Uso diario,,,,,,,,,,,,No,,,,,,https://kf.kobotoolbox.org/api/v2/assets/aXi3htSMn4QfEDCtR4ZVnV/data/617346433/attachments/attu5tc4MtBFr5vydgKzFwbX/,,136,136-CDMX,124
28/11/2025,28/11/2025,28/11/2025,CDMX,,51,,,Punto de Cruz,Punto cruz,Cruz chuy,Maya Yucateco,,Campeche,Hopelchén,Bolonchen de Rejon,se_realiza_a_mano,1,0,0,0,0,0,0,,No,,0,0,0,0,,,,,madre,1,0,0,0,0,0,0,0,,a_hijos s__a_mis_sobrinas_o_sobrinos,0,0,1,0,1,0,0,0,,,,,,,,,,,,Batas campechenos,Celebración del mes de campechan8,Trajes de noche,Bodas o xv años,Filipinas,Bailables folclore del pueblo,Trajes de niños,,,,,,,,,,No,,,,,,https://kf.kobotoolbox.org/api/v2/assets/aXi3htSMn4QfEDCtR4ZVnV/data/617346467/attachments/attmoV68WQEKUYWH7SnEdhpJ/,,137,137-CDMX,125
28/11/2025,28/11/2025,28/11/2025,CDMX,mujer,61,,,Tejido de ojitos,Tejido de ojitos,Quechquemetl ixtololoya,Náhuatl,,Veracruz de Ignacio de la Llave,Mixtla de Altamirano,Mixtla,se_realiza_a_mano se_realiza_a_m_quina_de_pedal otra,1,1,1,0,0,0,0,,Sí,te_ido_con_sales_y_minerales__ejem__alum te_ido_con_con_insectos_y_animales__ejem,0,1,1,0,"Brasil, cochinilla, flor de muertos, palo de campeche, sal en azul, hierba sol",es_una_t_cnica_antigua,"Se trabaja em campo, la siembra de haba, chicharo","Lana, un poco de hilo",abuela,0,0,1,0,0,0,0,0,,s__a_mis_hijas_o_hijos,0,1,0,0,0,0,0,0,,Calzon de manta,Camisa de tata,Falda de nana,Camisa de nana,Mangas de tata,Tlacoyales,Morral,Servilletas,Aretes,,Mayordomia,Fiesta patronal,Xochitlalli,Tierra para el crecimiento de alimentos,Limpias con huevo,,Medicina tradicional,,,,,,,,,,Sí,Maíz,Tierra,,,,https://kf.kobotoolbox.org/api/v2/assets/aXi3htSMn4QfEDCtR4ZVnV/data/617346715/attachments/att36zQf7eMP2cycT2jjBkxg/,,142,142-CDMX,131
28/11/2025,28/11/2025,28/11/2025,CDMX,hombre,33,,,Telar de cintura,Telar de cintura,Tejido,,Totonaca,Puebla,Pantepec,Pantepec,otra,0,0,1,0,0,0,0,,No,,0,0,0,0,,es_una_t_cnica_antigua,Se utiliza para el enredo de la nahua totonaca,Hilos de algodón o lana,de_una_maestra_o_instructora,0,0,0,0,0,0,1,0,,si__a_otra_persona,0,0,0,0,0,0,0,1,A mis trabajadoras del taller textil,Faja tradicional totonaca,,,,,,,,,,Esta pieza se usaba cotidianamente porque con eso se sujeta la enahua,,,,,,,,,,,,,,,,Sí,Contiene iconografía pero desconozco el significado,,,,,https://kf.kobotoolbox.org/api/v2/assets/aXi3htSMn4QfEDCtR4ZVnV/data/617346783/attachments/attZF6gyzwaGMGaXbSmZ9vsJ/,,143,143-CDMX,132
28/11/2025,28/11/2025,28/11/2025,CDMX,hombre,59,,,Recorte de cuadros,Recorte de cuadros,,Náhuatl,,Tlaxcala,Amaxac de Guerrero,Contcla,se_realiza_con_tejido_a_mano,0,0,0,0,0,1,0,,Sí,te_ido_con_plantas__ejem__muicle__peric_ te_ido_con_sales_y_minerales__ejem__alum te_ido_con_con_insectos_y_animales__ejem,1,1,1,0,"Grana cochinilla, añil, pericón, palo de Brasil",es_una_t_cnica_antigua,Usos,Alumbre,t_a,0,0,0,1,0,0,0,0,,a_hijos,0,0,1,0,0,0,0,0,,Gaban,Sarape,Corrido,,,,,,,,Gabanes,,,,,,,,,,,,,,,,Sí,La ecografía del pueblo,,,,,https://kf.kobotoolbox.org/api/v2/assets/aXi3htSMn4QfEDCtR4ZVnV/data/617346954/attachments/attbBPYEwshkFjVkkSwN6mGy/,,144,144-CDMX,133
28/11/2025,28/11/2025,28/11/2025,CDMX,mujer,55,,,Punto de Cruz,Punto de cruz,Tlahtsontli,Náhuatl,,Veracruz de Ignacio de la Llave,Chicontepec,Ixcacuatitla,se_realiza_a_mano,1,0,0,0,0,0,0,,No,,0,0,0,0,,es_una_t_cnica_antigua,nos cuenta la historia sobre la tradición de los trajes que se tienen que perder,manta y hilo,abuela,0,0,1,0,0,0,0,0,,s__a_mis_hijas_o_hijos a_hijos,0,1,1,0,0,0,0,0,,las blusas  tradicionales,,,,,,,,,,cuando ase las  rituales custubres,,,,,,,,,,,,,,,,Sí,las tradiciones,,,,,https://kf.kobotoolbox.org/api/v2/assets/aXi3htSMn4QfEDCtR4ZVnV/data/617346967/attachments/attGX6ZGEuW2gjSnwdzpHd9X/,,145,145-CDMX,134
28/11/2025,28/11/2025,28/11/2025,CDMX,mujer,66,,,Telar de cintura,Telar de cintura,Mahua no,Amuzgo,,Guerrero,,,se_realiza_a_mano otra es_una_t_cnica_mixta,1,0,1,1,0,0,0,,No,,0,0,0,0,,es_una_t_cnica_antigua,,"Hilo Omega, algodón, hilo grueso.",cu_ada,0,0,0,0,0,1,0,0,,s__a_mis_hijas_o_hijos,0,1,0,0,0,0,0,0,,Manteles,Huipiles,Blusas,Servilletas,Caminos de mesa,Reboso,Camisas para niño y adulto,,,,Huipiles,Ferias y fiestas de la Virgen de la inmaculada Concepción,Manteles,Fiestas patronales,,,,,,,,,,,,,Sí,Las grecas significan flores de la montaña,,,,,https://kf.kobotoolbox.org/api/v2/assets/aXi3htSMn4QfEDCtR4ZVnV/data/617347009/attachments/attm33Z6HwwxkQKLhmfLfHXm/,,146,146-CDMX,135
28/11/2025,28/11/2025,28/11/2025,CDMX,mujer,43,,,Telar de cintura,Tejido en telar de cintura,Petatillo,,,Veracruz de Ignacio de la Llave,Cosoleacaque,,se_realiza_con_tejido_a_mano otra,0,0,1,0,0,1,0,,Sí,otro,0,0,0,1,Hilos de algodón,es_una_t_cnica_antigua,,"Hilos, maderas e instrumentos hechos por el artesano",cu_ada,0,0,0,0,0,1,0,0,,si__a_otra_persona,0,0,0,0,0,0,0,1,,Rebozos,Fajas de figura,Tali,,,,,,,,,,,,,,,,,,,,,,,,No,,,,,,,,147,147-CDMX,136
28/11/2025,28/11/2025,28/11/2025,CDMX,hombre,58,,,Talakaxtokgo da makan,Bordado rústico a mano,Talakaxtohgo xa makan,Totonaco,,Veracruz de Ignacio de la Llave,Papantla,El Tajín,se_realiza_a_mano,1,0,0,0,0,0,0,,Sí,te_ido_con_plantas__ejem__muicle__peric_,1,0,0,0,"Cáscara de pichoco, moguite, flor de muerto, frijolillo, mora, cáscara coco, semilla de aguacate, huizache, palo de Brasil, añil, cúrcuma, resina de plátano",es_una_t_cnica_antigua,"Historia de familia, uso de bordado en prendas para ceremonias","Hilo de algodón, manta cruda, manta blanca, rayón, lino",madre,1,0,0,0,0,0,0,0,,s__a_mis_sobrinas_o_sobrinos si__a_otra_persona,0,0,0,0,1,0,0,1,Niños en escuelas,Blusas,Vestidos,Batas,Pañuelos,,,,,,,Boda,,Ceremonia religiosa,,Ceremonia corona de espinas,,,,,,,,,,,,Sí,La naturaleza,,,,,https://kf.kobotoolbox.org/api/v2/assets/aXi3htSMn4QfEDCtR4ZVnV/data/617347508/attachments/att7HirXm4ueShTKSEuLFFEd/,,148,148-CDMX,137
28/11/2025,28/11/2025,28/11/2025,CDMX,mujer,59,,,Deshilado,Deshilado y bordado,Pitakata,Purépecha,,Michoacán de Ocampo,Charapan,,se_realiza_a_mano se_realiza_con_tejido_a_mano,1,0,0,0,0,1,0,,No,,0,0,0,0,,es_una_t_cnica_antigua,,"Hilaza, hilo de algodón, tela de bramante",madre t_a,1,0,0,1,0,0,0,0,,s__a_mis_hijas_o_hijos a_hijos s__a_mis_nietas_o_nietos s__a_mis_sobrinas_o_sobrinos s__a_estudiantes si__a_otra_persona,0,1,1,1,1,0,1,1,Hermanas,Manteles,Blusas,Camisa de hombre,Pantalones,Rebozos,,,,,,Domingo de Ramos,Traje típico (pañete) rollo negro,,,,,,,,,,,,,,,Sí,Pertenencia e identificación de otros municipios y en su caso de marca.,,,,,https://kf.kobotoolbox.org/api/v2/assets/aXi3htSMn4QfEDCtR4ZVnV/data/617347537/attachments/attoXEhWpV3VDjrPgs7moXkq/,,149,149-CDMX,138
28/11/2025,28/11/2025,28/11/2025,CDMX,mujer,41,,,Rococó,Rococo,"Rococo, nudo",Tseltal,,Chiapas,Venustiano Carranza,,se_realiza_a_mano,1,0,0,0,0,0,0,,No,,0,0,0,0,,es_una_t_cnica_antigua,"Me enseño mi mamá, se pasa de generación en generación","Tela: rayón, mante corrugado, mante crudo",madre,1,0,0,0,0,0,0,0,,s__a_mis_hijas_o_hijos,0,1,0,0,0,0,0,0,,Vestidos,Blusas,Bata,Bluson,Guayavera,,,,,,Feria,,,,,,,,,,,,,,,,No,,,,,,https://kf.kobotoolbox.org/api/v2/assets/aXi3htSMn4QfEDCtR4ZVnV/data/617349296/attachments/att34AdLKF5z4x2sj3Fsk6WJ/,,166,166-CDMX,154
28/11/2025,28/11/2025,28/11/2025,CDMX,hombre,65,,,Tejido de fibra natural,"Fibra vegetal, tejido de palma",Juchari uinapekua xarhaku,Purépecha,,Michoacán de Ocampo,Erongarícuaro,Haracuaro,se_realiza_con_tejido_a_mano,0,0,0,0,0,1,0,,Sí,te_ido_con_sales_y_minerales__ejem__alum,0,1,0,0,"Sal, anelinas",es_una_t_cnica_antigua,"A través de los abuelitos, credo por tradición, usos y costumbres",Palma,madre padre abuela hermana,1,1,1,0,1,0,0,0,,a_hijos s__a_mis_sobrinas_o_sobrinos s__a_estudiantes si__a_otra_persona,0,0,1,0,1,0,1,1,,Sombreros,Tapetes,Portavasos,Tortilleros,Manualidades,Bolsas,,,,,Sombrero,,Tapetes,,,,,,,,,,,,,,Sí,Religión,Cultural,,,,https://kf.kobotoolbox.org/api/v2/assets/aXi3htSMn4QfEDCtR4ZVnV/data/617348096/attachments/attErjRQRfy5UQVYmGkR9xcW/,,157,157-CDMX,145
28/11/2025,28/11/2025,28/11/2025,CDMX,mujer,65,,,Tejido de semilla,Bordado primavera y tejido de semilla,Bordado primavera y tejido semilla,,,Oaxaca,San Antonino Castillo Velasco,,se_realiza_a_mano se_realiza_con_tejido_a_mano,1,0,0,0,0,1,0,,No,otro,0,0,0,1,,es_una_t_cnica_antigua,Por ejemplo las flores representan el campo de la comunidad,"Hilo, aguja,tela, aro",abuela,0,0,1,0,0,0,0,0,,s__a_mis_hijas_o_hijos s__a_estudiantes,0,1,0,0,0,0,1,0,,Blusas,Camisas,Vestidos,Rebozos,Bufandas,Corset,Carteras,Bolsas,Aretes,Camino de mesas,Feria del pueblo y eventos importantes,,Feria de de municipio y eventos importantes,,Eventos importantes y ferias del municipio,,En cualquier evento importante,,En Vento importantes o para uno del día,,Para eventos importantes y elegantes,,Para eventos importantes y ferias,,Para una fiesta elegantes,,Sí,La originalidad de pueblo,Lo originalidad del pueblo,La originalidad del pueblo,La originalidad del pueblo,La originalidad del pueblo,,,150,150-CDMX,139
28/11/2025,28/11/2025,28/11/2025,CDMX,mujer,65,,,Bordado primavera,Bordado primavera y tejido de semilla,Bordado primavera y tejido semilla,,,Oaxaca,San Antonino Castillo Velasco,,se_realiza_a_mano se_realiza_con_tejido_a_mano,1,0,0,0,0,1,0,,No,otro,0,0,0,1,,es_una_t_cnica_antigua,Por ejemplo las flores representan el campo de la comunidad,"Hilo, aguja,tela, aro",abuela,0,0,1,0,0,0,0,0,,s__a_mis_hijas_o_hijos s__a_estudiantes,0,1,0,0,0,0,1,0,,Blusas,Camisas,Vestidos,Rebozos,Bufandas,Corset,Carteras,Bolsas,Aretes,Camino de mesas,Feria del pueblo y eventos importantes,,Feria de de municipio y eventos importantes,,Eventos importantes y ferias del municipio,,En cualquier evento importante,,En Vento importantes o para uno del día,,Para eventos importantes y elegantes,,Para eventos importantes y ferias,,Para una fiesta elegantes,,Sí,La originalidad de pueblo,Lo originalidad del pueblo,La originalidad del pueblo,La originalidad del pueblo,La originalidad del pueblo,,,151,151-CDMX,139
28/11/2025,28/11/2025,28/11/2025,CDMX,mujer,40,,,Bordado de dos agujas,Dos agujas,Dos agujas,Náhuatl,Mazahua,México,Villa de Allende,San Felipe Santiago,se_realiza_a_mano,1,0,0,0,0,0,0,,Sí,te_ido_con_plantas__ejem__muicle__peric_,1,0,0,0,Flores del rio cascara de nuez,es_una_t_cnica_antigua,Historias de nuestro antepasados,Manta aguja tela y lanas,madre,1,0,0,0,0,0,0,0,De mi mamá,a_hijos,0,0,1,0,0,0,0,0,,Rebozo,Camisas,Falda,Cuadros,Sinturon,Caminos de mesa,Carpetas,Morales,Cojines,Blusas,Los rebozos en las fiestas patronal,,Los morales para poner a los santos,,,,,,,,,,,,,,Sí,Tradiciones de mi pueblo,,,,,https://kf.kobotoolbox.org/api/v2/assets/aXi3htSMn4QfEDCtR4ZVnV/data/617347698/attachments/attx8SE6yYwHQj5tFzJy5avb/,,152,152-CDMX,140
28/11/2025,28/11/2025,28/11/2025,CDMX,mujer,33,,,Pepenado en pliegue,Pepenado en pliegue,Pepenado en pliegue,Otomí,Otomí variante yumu de Tlaxcala,Tlaxcala,Ixtenco,ixtenco,se_realiza_a_mano,1,0,0,0,0,0,0,,No,te_ido_con_con_insectos_y_animales__ejem,0,0,1,0,La grana cochinilla,es_una_t_cnica_antigua,El bordado de pepenado es un aprenda que la usaban nuestros maestros como prenda interior y hoy en la actualidad ya es una prenda que se deja aver.,"Tela, hilo de algodón y chaquira calibrada.",abuela,0,0,1,0,0,0,0,0,,si__a_otra_persona,0,0,0,0,0,0,0,1,A estudiantes,Blusas,Bestidos,Monederos,Gorras,Diademas,,,,,,En mayordomias,,Fiestas patronales,,,,,,,,,,,,,,Sí,Representa nuestros orígenes otomis,,,,,https://kf.kobotoolbox.org/api/v2/assets/aXi3htSMn4QfEDCtR4ZVnV/data/617347717/attachments/atta5pZvW2QxxNWGxbV6nmo6/,,153,153-CDMX,141
28/11/2025,28/11/2025,28/11/2025,CDMX,no_especificar,41,,,Plisada,Plisada,Plisado,,náhuatl de tepozonalco guerrero,Guerrero,Chilapa de Álvarez,tepozonalco,es_una_t_cnica_mixta,0,0,0,1,0,0,0,,No,,0,0,0,0,,es_una_t_cnica_antigua,Traje tradicional de usos y costumbres,"Tela Bombay, listones, encaje, hilo, agujas",madre,1,0,0,0,0,0,0,0,,s__a_mis_hijas_o_hijos s__a_mis_sobrinas_o_sobrinos s__a_estudiantes,0,1,0,0,1,0,1,0,,Traje tradicional,Muñecas,,,,,,,,,Uso diario,,,,,,,,,,,,,,,,No,,,,,,https://kf.kobotoolbox.org/api/v2/assets/aXi3htSMn4QfEDCtR4ZVnV/data/617347799/attachments/attHV24caGRBnW7vqYLZ4q9D/,,154,154-CDMX,142
28/11/2025,28/11/2025,28/11/2025,CDMX,mujer,47,,,Pepenado,Pepenado,Tlapejpenale,Náhuatl,,Puebla,San José Miahuatlán,San Mateo Tlacoxcalco,se_realiza_a_mano,1,0,0,0,0,0,0,,No,,0,0,0,0,,es_una_t_cnica_antigua,"Es un bordado de más de 500 años de antigüedad en ella muestra la cultura ,la identidad y la indumentaria de nuestros antepasados en ella conocemos que cómo vivían ellos atrás vez de la flora y fauna es una riqueza cultural de nuestro pueblo","Cabeza de indio,aguja del número 6,hilo de algodón ,manta ,lino, rayon",madre,1,0,0,0,0,0,0,0,,s__a_mis_nietas_o_nietos s__a_estudiantes,0,0,0,1,0,0,1,0,,"Blusa para las bodas tradicionales,",Guayaberas para las bodas,Uniformes que se están implementando en las escuelas,Indumentaria cotidiana o en eventos especiales,Eventos religiosos,,,,,,Bodas,,Bautizos,,Desfiles,,Fiestas tradicionales,,,,,,,,,,Sí,Flora de la region,Fauna,Via lactea,Sobre todo iconografia de nuestra localidad,,https://kf.kobotoolbox.org/api/v2/assets/aXi3htSMn4QfEDCtR4ZVnV/data/617347856/attachments/attjqUg4d8e3Th7HXrskWx9X/,,155,155-CDMX,143
28/11/2025,28/11/2025,28/11/2025,CDMX,mujer,29,,,Bordado Ch'ol Tzeltal,Bordado cho'l  Tzeltal,Yomol bordando historia cho'l Tzeltal,Tseltal,,Chiapas,Palenque,Localidad profesor Roberto barrios,se_realiza_a_mano,1,0,0,0,0,0,0,,No,,0,0,0,0,,es_una_t_cnica_antigua,Para nosotras significa nuestra  naturaleza  las pirámides de los mayas,Telas hilos de tres hebras ajugas  aro,t_a,0,0,0,1,0,0,0,0,,s__a_mis_hijas_o_hijos,0,1,0,0,0,0,0,0,,Wipiles,Blusas,Tiras bordado,Bolsas y monederos  diademas,huayaberas,,,,,,Traje tradicional,,,,,,,,,,,,,,,,No,Las pirámides de los mayas,,,,,https://kf.kobotoolbox.org/api/v2/assets/aXi3htSMn4QfEDCtR4ZVnV/data/617347899/attachments/attwhEvir3FYa3acw8mRDS9d/,,156,156-CDMX,144
28/11/2025,28/11/2025,28/11/2025,CDMX,mujer,51,,,Punto de Cruz,punto de cruz,CRUZCHUY de,,,Campeche,Hopelchén,Crucero san Luis,se_realiza_a_mano se_realiza_a_m_quina_de_pedal es_una_t_cnica_mixta,1,1,0,1,0,0,0,,No,otro,0,0,0,1,Comprando  hago los hilos,es_una_t_cnica_nueva,,,padre,0,1,0,0,0,0,0,0,,si__a_otra_persona,0,0,0,0,0,0,0,1,Mi padre me enseñó a bordar,,,,,,,,,,,,,,,,,,,,,,,,,,,No,,,,,,,,167,167-CDMX,155
28/11/2025,28/11/2025,28/11/2025,CDMX,mujer,31,San Bartolomé Ayautla,,Relleno,Punto de relleno,Indu maya,Mazateco,,Oaxaca,San Bartolomé Ayautla,SAN BARTOLOMÉ AYAUTLA,se_realiza_a_mano,1,0,0,0,0,0,0,,Sí,te_ido_con_plantas__ejem__muicle__peric_,1,0,0,0,"Cempasuchil,  añil, pericon , sellador , acido,sal .",es_una_t_cnica_antigua,"El punto de relleno es una técnica antigua que  se utilizaba para representar el árbol de la vida , y a su vez en ella representamos el amor y la unión con la familia en este bordado plasmamos guías que representan las ramas y las flores y pájaros representan la familia y la armonía.","Tela : manta , lino , etamina, telar de pedal y de cintura. Hilo vela , hilos teñidos naturalmente,  hilos mercerizados, aguja capotera, carbon ,plumin, maquina de coser..",t_a,0,0,0,1,0,0,0,0,,si__a_otra_persona,0,0,0,0,0,0,0,1,Clientas y a mujeres de la comunidad.,Huipiles largos,Huipiles cortos,Guayaberas,Enaguas,Monederos,Almohadas,Servilletas,Caminos de mesa,Rebozo,Chalecos,Bodas,Bautizos,Reuniones,Fiestas patronales,Clausuras,Misas,Eventos de fin de año,,,,,,,,,,Sí,"Representan al árbol de la vida , unión y amor",Familia,Flora,Fauna,Hermandad de la comunidad,https://kf.kobotoolbox.org/api/v2/assets/aXi3htSMn4QfEDCtR4ZVnV/data/617348154/attachments/attms3yLM8EZwtgQXqtKfAEp/,https://kf.kobotoolbox.org/api/v2/assets/aXi3htSMn4QfEDCtR4ZVnV/data/617348154/attachments/attUcnMatNjiv3aeVnhKvRXJ/,158,158-CDMX,146
28/11/2025,28/11/2025,28/11/2025,CDMX,mujer,67,,,Telar de cintura,Telar de cintura,,,,Oaxaca,San Pedro Cajonos,,,0,0,0,0,0,0,0,,Sí,te_ido_con_plantas__ejem__muicle__peric_ te_ido_con_con_insectos_y_animales__ejem,1,0,1,0,,es_una_t_cnica_antigua,La abuela empezó a criar elgusano de seda. Cuando cria hierve y coce e hila con malacate.,Seda del gusanito,abuela,0,0,1,0,0,0,0,0,,s__a_mis_sobrinas_o_sobrinos,0,0,0,0,1,0,0,0,,rebozos,huipiles,blusa,bufanda,,,,,,,16 de septiembre,,Bodas,,Fiestas patronales,,,,,,,,,,,,Sí,Recuerdo de la abuela de forma personal,,,,,https://kf.kobotoolbox.org/api/v2/assets/aXi3htSMn4QfEDCtR4ZVnV/data/617348208/attachments/att29dQDBbmkSveEdYk7fbhd/,,159,159-CDMX,147
28/11/2025,28/11/2025,28/11/2025,CDMX,mujer,49,Amuzga. No habla español,,Telar de cintura,Telar de cintura,Amuzga telar de cintura,Amuzgo,No,Guerrero,Xochistlahuaca,Xochistlahuaca,otra,0,0,1,0,0,0,0,,Sí,te_ido_con_plantas__ejem__muicle__peric_,1,0,0,0,Cempasuchil,es_una_t_cnica_antigua,Sus abuelo le enseñarlo,Hilos,madre,1,0,0,0,0,0,0,0,,s__a_mis_hijas_o_hijos,0,1,0,0,0,0,0,0,,Huipil,Reboso,Blusa,Servilleta,Concha de armadillo hupil,Bordar,Mantel,Bufanda,Campeta,Centro de mesa,Boda,Fiesta,Bautizo,,Cumpleaños,,,,,,,,,,,,No,Flor,Imaginacion,,,,,,160,160-CDMX,148
28/11/2025,28/11/2025,28/11/2025,CDMX,mujer,42,,,Otomí,Otomí,,Otomí,,Hidalgo,Tenango de Doria,,se_realiza_a_mano,1,0,0,0,0,0,0,,No,,0,0,0,0,,,"Se da apartir de las necesidades económicas, a partir  de una gran sequía donde la señora Josefina Tavera empieza a plasmar en manta la flora y fauna de la región","Manta,hilo vela( algodón), aguja, bastidor; actualmente se ulizan diferentes tipos de tela",madre abuela,1,0,1,0,0,0,0,0,,s__a_mis_hijas_o_hijos a_hijos,0,1,1,0,0,0,0,0,,Caminos de mesa,Cojines,Camisas,Blusas,Chamarras,Sudaderas,Vestidos,Sacos,Portavasos,Faldas,,,,,,,,,,,,,,,,,Sí,"Representa la flora y fauna de la región,costumbres y tradiciones",,,,,https://kf.kobotoolbox.org/api/v2/assets/aXi3htSMn4QfEDCtR4ZVnV/data/617348536/attachments/attz7WfaYCTHBuHZCRUmWDDx/,,161,161-CDMX,149
28/11/2025,28/11/2025,28/11/2025,CDMX,mujer,58,,,Bordado tradicional,Bordado textil,Nahu chine,Mazateco,,Oaxaca,San Miguel Soyaltepec,,se_realiza_a_mano,1,0,0,0,0,0,0,,No,otro,0,0,0,1,Manta hilo lapiceros agujas aros,es_una_t_cnica_antigua,Estás prendas  bordadas las utilizaban las personas que se csa  a,,madre,1,0,0,0,0,0,0,0,,s__a_mis_hijas_o_hijos,0,1,0,0,0,0,0,0,,Huipiles,Batas,Blusas,Camisas,,,,,,,Para ocasiones especiales en el pueblo,,,,,,,,,,,,,,,,Sí,Cerros,Flores,Enramadas,Animales,,,,162,162-CDMX,150
28/11/2025,28/11/2025,28/11/2025,CDMX,mujer,37,,,Telar de cintura,Telar de cintura,Jalbil ta ch’ujt’il,Tseltal,,Chiapas,Oxchuc,Oxchuc,otra,0,0,1,0,0,0,0,,No,,0,0,0,0,,es_una_t_cnica_antigua,Que los bordados tienen significado,Algodón,madre,1,0,0,0,0,0,0,0,,s__a_mis_sobrinas_o_sobrinos,0,0,0,0,1,0,0,0,,Fiestas patronales,Fiesta de la virgen de Guadalupe,Fiesta de la ciembra del cultivo,,,,,,,,Fiesta del santo patrono,,En la boda tradicional,,,,,,,,,,,,,,Sí,Los cuatro puntos cardenales,El nombre de mi municipio,,,,https://kf.kobotoolbox.org/api/v2/assets/aXi3htSMn4QfEDCtR4ZVnV/data/617348983/attachments/attqUMm4QJjQAs3eDP6N2u3R/,,163,163-CDMX,151
28/11/2025,28/11/2025,28/11/2025,CDMX,mujer,34,,,Bordados de chamula y larrainzar,Bordados de chamula y larrainzar vestidos camisas,Bordados de maizal y huipil,Tsotsil,,Chiapas,Villaflores,Colonia ejido nueva palestina... municipio Villaflores,se_realiza_a_mano se_realiza_con_tejido_a_mano otra,1,0,1,0,0,1,0,,No,otro,0,0,0,1,,,,Hilo mish de algodón de colores,madre padre abuela,1,1,1,0,0,0,0,0,,s__a_mis_hijas_o_hijos,0,1,0,0,0,0,0,0,,,,,,,,,,,,Huipil ceremonial,,Traje tradicional de San Juan Chamula,,,,,,,,,,,,,,No,Huipil ceremonial,Blusas de maizal,Vestidos bordados de animalitos,Camino de. Mesa,,https://kf.kobotoolbox.org/api/v2/assets/aXi3htSMn4QfEDCtR4ZVnV/data/617349026/attachments/attFexuwEcNHudKWMTCGWDQF/,,164,164-CDMX,152
