start,end,Fecha,Sede,Genero,Edad,Notas,tecnica_grupo,Tecnica,Descripción,Tecnica_lengua,Lengua,Lengua_nota,Estado,Municipio,Localidad,Manufactura,Mano,Pedal,Telar,Mixta,Otra,Tejido,Telar_pedal,Manufactura_especifique,Tenido,Tipo_tenido,Plantas,Minerales,Animales,Otro,Tenido_especifique,Temporalidad,Historia,Materiales,Aprendizaje,Madre,Abuela,Tia,Hermana,Cunada,Instructora,Aprendi_otro,Padre,Aprendizaje_especifique,Ensenanza,No_ensenado,Hijas,Nietos,Sobrinos,Pareja,Estudiantes,Enseno_otra,Hijos,Ensenar_especifique,pr1,pr8,pr2,pr4,pr10,pr9,pr3,pr5,pr7,pr6,c6,cm7,c3,cm3,c7,cm5,c4,cm4,c1,cm1,c2,cm2,c8,cm8,c5,cm6,Significado,S1,S2,S3,S4,S5,pic,video,index,concat_id,_index
12/11/2025,12/11/2025,12/11/2025,Tijuana,mujer,36,,Bordado a mano,Bordado con dos agujas,,Yeje dyepjadu,Mazahua,,México,Villa de Allende,San Felipe Santiago,se_realiza_a_mano,1,0,0,0,0,0,0,,Sí,te_ido_con_plantas__ejem__muicle__peric_ te_ido_con_sales_y_minerales__ejem__alum te_ido_con_con_insectos_y_animales__ejem,1,1,1,0,"Distintas plantas,como pericon ,cáscara de nuez,grana cochinilla,cantues , muitle ,musgo silvestre etc.",es_una_t_cnica_antigua,En cuanto a la puntada es una puntada antigua que viene desde nuestros antepasado ya que nos platican que como usaban el tradicional calzon de manta las mujeres aprendieron a coser y poco a poco lo fueron perfeccionando y nosotros ya buscamos nuevas técnicas como el uso de tintes naturales como nueva técnica,Como materia prima  tela de algodón y lana así como hilos de algodón y lana teñida,madre otra,1,0,0,0,0,0,1,0,Suegra,a_hijos,0,0,0,0,0,0,0,1,,Blusas,Camisas,Caminos de mesa,Bolsitas,Pulceras,Separadores,Servilletas,Portavasos,Aretes,Quesquemelt,En fiestas del pueblo,,En misa,,Salidas de paseo,,Mayordomia,,,,,,,,,,Sí,La flora y fauna de la comunidad,La fertilidad,Los puntos cardinales,Equilibrio entre el cuerpo y espíritu,,https://kf.kobotoolbox.org/api/v2/assets/aUw72KrDA2sRGCi7GuKuXD/data/604518074/attachments/attnVgaWyShBhNpYRhwkhUQM/,,083,083-Tijuana,77
12/11/2025,12/11/2025,12/11/2025,Tijuana,mujer,65,,Bordado a mano,Bordado de San Antonio,,,Zapoteco,,Oaxaca,San Antonino Castillo Velasco,Sanantonino castillo velazco,se_realiza_a_mano,1,0,0,0,0,0,0,,No,,0,0,0,0,,es_una_t_cnica_antigua,Historia,Hilo de seda y aguja de mano,madre t_a,1,0,1,0,0,0,0,0,,s__a_mis_hijas_o_hijos s__a_mis_nietas_o_nietos s__a_estudiantes,0,1,1,0,0,1,0,0,,Camisas,Blusas,Batas,Vestidos faldas,Sacos,,,,,,Bodas,,Mayordomías,,Fiestas tradicionales,,Evento culturales y tradicionales,,,,,,,,,,Sí,El campo,Las flores,La siembra,Los cultivos,Naturaleza,https://kf.kobotoolbox.org/api/v2/assets/aUw72KrDA2sRGCi7GuKuXD/data/604518181/attachments/attP7j9NdjSzoLJj9vGXiCKh/,,084,084-Tijuana,78
12/11/2025,12/11/2025,12/11/2025,Tijuana,mujer,26,,Telar de cintura,Telar de cintura,,Jolobil,Tsotsil,,Chiapas,Venustiano Carranza,Paraíso del Grijalva,otra,0,0,1,0,0,0,0,,No,te_ido_con_con_insectos_y_animales__ejem,0,0,1,0,,es_una_t_cnica_antigua,,,madre,1,0,0,0,0,0,0,0,,,0,0,0,0,0,0,0,0,,Huipiles,Batas,Reboso,Blusón,Camisas,Faldas,,,,,Huipil y falda,Bodas,Batas,Fiestas patronales,,,,,,,,,,,,,Sí,Naturaleza del pueblo tsotsil,,,,,https://kf.kobotoolbox.org/api/v2/assets/aUw72KrDA2sRGCi7GuKuXD/data/604518252/attachments/attFZhy3aiNzEDvK4GuYK6RT/,,085,085-Tijuana,79
12/11/2025,12/11/2025,12/11/2025,Tijuana,hombre,62,,Telar de cintura,Pepenado,,,Otomí,,Hidalgo,Ixmiquilpan,,otra,0,0,1,0,0,0,0,,No,,0,0,0,0,,es_una_t_cnica_antigua,,Lana y algodon,padre,0,0,0,0,0,0,0,1,,s__a_mis_hijas_o_hijos,0,1,0,0,0,0,0,0,,Ponchos,Rebozos,Capas,Blusas,Vestidos,Morrales,Monederos,,,,Religiosos,,Eventos culturales,,,,,,,,,,,,,,No,Nuestra cultura e identidad,,,,,https://kf.kobotoolbox.org/api/v2/assets/aUw72KrDA2sRGCi7GuKuXD/data/604518280/attachments/attrPAY5ZdHz2EQPQ42zMojd/,,086,086-Tijuana,80
12/11/2025,12/11/2025,12/11/2025,Tijuana,mujer,,,Telar de cintura,Telar de cintura,,Takit,Náhuatl,,Puebla,Cohetzala,,se_realiza_a_mano,1,0,0,0,0,0,0,,No,,0,0,0,0,,es_una_t_cnica_antigua,Para hacer vestimentas,Hilo algodón y mercerizado,madre,1,0,0,0,0,0,0,0,,s__a_mis_hijas_o_hijos si__a_otra_persona,0,1,0,0,0,0,1,0,,Hupil de gala,Blusa,Coyocoton,Tengo huipil,Xochipayo,,,,,,Bodas,,Fiestas patronales,,Bautizo,,Mayordomia,,,,,,,,,,Sí,Árbol de la vida,Naturaleza,Danza para los Quetzales,,,,,087,087-Tijuana,81
12/11/2025,12/11/2025,12/11/2025,Tijuana,mujer,27,,Telar de cintura,Telar de cintura,,Tsa jmö tą,,Chinanteco variante de san Lucas Ojitlán,Oaxaca,San Lucas Ojitlán,San Lucas Ojitlán,otra,0,0,1,0,0,0,0,,No,,0,0,0,0,,es_una_t_cnica_antigua,Que nuestros ancestros hacían su trajes sobre telar de cintura ya que contaban con los materiales por ejemplo algodón puro y sacaban su hilo en malacate,Hilos de algodón Y algunos agujas caputeras Hacer el urdimbre los hilos de colores para la trama varas que se ocupan como pasante en el urdimbre posteriormente se borda después de terminar el telar,madre,1,0,0,0,0,0,0,0,,s__a_mis_sobrinas_o_sobrinos s__a_una_pareja,0,0,0,1,1,0,0,0,,Huipil de gala,Huipil media gala,Huipil de uso diario,Refajos o enajuas,Camisas,Cenefas,Vestidos estilizados,Monederos,Servilletas,Mantillas o rebozos,Bodas,Quince años,Eventos políticos,Día de muertos,Bautizos,Comuniones,Confirmaciones,Eventos religiosos,Campañas,,Uso diario,,,,,,Sí,Representa el águila bicéfala,Randa o arcoiris,Serpiente emplumada,Camino de la vida,Ojos de agua ríos presas manantiales,https://kf.kobotoolbox.org/api/v2/assets/aUw72KrDA2sRGCi7GuKuXD/data/604518307/attachments/att8GkEgsjrjrW4tdZ5rJsoR/,,088,088-Tijuana,82
12/11/2025,12/11/2025,12/11/2025,Tijuana,mujer,27,,Bordado a mano,Hilván,,Tsa jmö tą,,Chinanteco variante de san Lucas Ojitlán,Oaxaca,San Lucas Ojitlán,San Lucas Ojitlán,otra,0,0,1,0,0,0,0,,No,,0,0,0,0,,es_una_t_cnica_antigua,Que nuestros ancestros hacían su trajes sobre telar de cintura ya que contaban con los materiales por ejemplo algodón puro y sacaban su hilo en malacate,Hilos de algodón Y algunos agujas caputeras Hacer el urdimbre los hilos de colores para la trama varas que se ocupan como pasante en el urdimbre posteriormente se borda después de terminar el telar,madre,1,0,0,0,0,0,0,0,,s__a_mis_sobrinas_o_sobrinos s__a_una_pareja,0,0,0,1,1,0,0,0,,Huipil de gala,Huipil media gala,Huipil de uso diario,Refajos o enajuas,Camisas,Cenefas,Vestidos estilizados,Monederos,Servilletas,Mantillas o rebozos,Bodas,Quince años,Eventos políticos,Día de muertos,Bautizos,Comuniones,Confirmaciones,Eventos religiosos,Campañas,,Uso diario,,,,,,Sí,Representa el águila bicéfala,Randa o arcoiris,Serpiente emplumada,Camino de la vida,Ojos de agua ríos presas manantiales,https://kf.kobotoolbox.org/api/v2/assets/aUw72KrDA2sRGCi7GuKuXD/data/604518307/attachments/att8GkEgsjrjrW4tdZ5rJsoR/,,089,089-Tijuana,82
12/11/2025,12/11/2025,12/11/2025,Tijuana,mujer,47,,Telar de cintura,Telar de cintura,,,,,Morelos,Hueyapan,,se_realiza_a_mano otra,1,0,1,0,0,0,0,,Sí,te_ido_con_plantas__ejem__muicle__peric_ te_ido_con_sales_y_minerales__ejem__alum te_ido_con_con_insectos_y_animales__ejem,1,1,1,0,Leña ollas y carbón,es_una_t_cnica_antigua,Historia,Cortesas flores hojas raíces,abuela,0,1,0,0,0,0,0,0,,s__a_mis_hijas_o_hijos s__a_estudiantes,0,1,0,0,0,1,0,0,,Gavan,Rebosos,Quexqueme,Ruanas,Bolsos,Cobijas,Chalecos,Monederos,Chamarasen,,En eventos importantes,,,,,,,,,,,,,,,,Sí,Cuidamos la naturaleza,Nos identifica,100 por siento natural,,,,,091,091-Tijuana,84
12/11/2025,12/11/2025,12/11/2025,Tijuana,mujer,33,,Telar de cintura,Telar de cintura,,,,,Morelos,Hueyapan,,se_realiza_a_mano otra,1,0,1,0,0,0,0,,Sí,te_ido_con_plantas__ejem__muicle__peric_ te_ido_con_sales_y_minerales__ejem__alum te_ido_con_con_insectos_y_animales__ejem,1,1,1,0,"Ollas,agua,leña,carbon",es_una_t_cnica_antigua,Historia de nuestras abuelas,Juego de palos de madera y las manos,abuela,0,1,0,0,0,0,0,0,,s__a_mis_hijas_o_hijos s__a_estudiantes,0,1,0,0,0,1,0,0,,Gabanes,Rebozos,Quexqueme,Bolsas,Ruanas,Cobijas,Chalecos,,,,Eventos especiales,,,,,,,,,,,,,,,,Sí,Cuidar la naturaleza,No dañamos el medio ambiente,Todo es 100% natural,es nuestra cultura,Identidad,https://kf.kobotoolbox.org/api/v2/assets/aUw72KrDA2sRGCi7GuKuXD/data/604518680/attachments/att366Y2AAEzyNwNrmfj2npM/,https://kf.kobotoolbox.org/api/v2/assets/aUw72KrDA2sRGCi7GuKuXD/data/604518680/attachments/attQWwKyNtCsYUv46FHCMUT6/,092,092-Tijuana,85
12/11/2025,12/11/2025,12/11/2025,Tijuana,mujer,23,,Telar de cintura,Brocado,,Batsi'l chil y lamal chil,Tseltal,,Chiapas,San Juan Cancuc,,otra,0,0,1,0,0,0,0,,No,otro,0,0,0,1,,es_una_t_cnica_antigua,Es una técnica ansestrales,Hilos de algodon,madre t_a,1,0,1,0,0,0,0,0,,s__a_mis_sobrinas_o_sobrinos,0,0,0,1,0,0,0,0,,El tejido con brocado fino,Se utiliza más en trajes de hombre,El brocado censillo,Se usa más en uso diario de mujeres,,,,,,,El tejidos con brocado finos,Se usa en fiestas tradicionales,,,,,,,,,,,,,,,Sí,El bordado de trajes de mujer en el cuello,Te presenta colmillos de jaguar,,,,https://kf.kobotoolbox.org/api/v2/assets/aUw72KrDA2sRGCi7GuKuXD/data/604518847/attachments/attKdt5nk6hrwGMeSQEsRgPy/,,093,093-Tijuana,86
12/11/2025,12/11/2025,12/11/2025,Tijuana,hombre,28,,Bordado a mano,Hazme si puedes,,,Zapoteco,,Oaxaca,Santa Ana Zegache,,,0,0,0,0,0,0,0,,No,,0,0,0,0,,,,,,0,0,0,0,0,0,0,0,,,0,0,0,0,0,0,0,0,,,,,,,,,,,,Bodas y mayordomía,,,,,,,,,,,,,,,,Sí,"El pepenado mas que un significado en la prenda sirve mas para cumplir una función , la cual va a la altura del busto y sirve para dar cavidad a esta parte del cuerpo.","El pepenado fruncido o hazme si puedes se realizan distintos motivos en su iconografía siendo los mas representativos, los muñequitos, la rosa x las flores de granadas, y los nombres de la persona que portara la blusa",,,,https://kf.kobotoolbox.org/api/v2/assets/aUw72KrDA2sRGCi7GuKuXD/data/604518900/attachments/attyWFKD7R6oq5Hj34qdmijN/,,094,094-Tijuana,87
12/11/2025,12/11/2025,12/11/2025,Tijuana,mujer,37,,Tejido a mano,Tejido con hoja de pino,,Huatave,Tarahumara,,Chihuahua,Urique,Huetosachi,se_realiza_a_mano,1,0,0,0,0,0,0,,No,,0,0,0,0,,es_una_t_cnica_antigua,"Canasta, palma sotol, guardar maíz, nixtamal",,abuela,0,1,0,0,0,0,0,0,,,0,0,0,0,0,0,0,0,Niños de la comunidad,Canastas,,,,,,,,,,Fiesta lavar nixtamal,,,,,,,,,,,,,,,,No,,,,,,,,095,095-Tijuana,88
28/11/2025,28/11/2025,28/11/2025,CDMX,hombre,43,,,Punto de Cruz,Bordados de puntos cruz,C,Amuzgo,,Guerrero,Ometepec,,se_realiza_a_mano,1,0,0,0,0,0,0,,Sí,te_ido_con_plantas__ejem__muicle__peric_,1,0,0,0,Hilos de algodón,es_una_t_cnica_antigua,,Hilos de algodón natural,madre,1,0,0,0,0,0,0,0,,s__a_mis_sobrinas_o_sobrinos,0,0,0,0,1,0,0,0,,Huipiles,Blusas,Bluson,Bolsa,Coton,,,,,,Bodas,,Bautizo,,Evento especiales,,,,,,,,,,,,No,Montaña,Flor de piŉas,,,,https://kf.kobotoolbox.org/api/v2/assets/aXi3htSMn4QfEDCtR4ZVnV/data/617331460/attachments/attNY2wgSUsPRUz5CpAQ6qLu/,,035,035-CDMX,35
12/11/2025,12/11/2025,12/11/2025,Tijuana,mujer,30,,Telar de cintura,Costura,,Shua sipuchi,Tarahumara,,Chihuahua,Bocoyna,Bosque San Elías repechique,otra,0,0,1,0,0,0,0,,No,otro,0,0,0,1,,es_una_t_cnica_nueva,,"Tela industrial, popelina, algodon,manta, hilo, aguja, de diferentes colores",madre,1,0,0,0,0,0,0,0,Mi mamá,s__a_mis_hijas_o_hijos,0,1,0,0,0,0,0,0,,Blusa,Falda,Fondo,Gorro para bebe,Todas las telas que se puedan coser etc,Tagora para hombre,,,,,Matachin diciembre,Toda la vestimenta completa,Bariceo semana santa,"Tagora,collera reboso",Ocasiones especiales personales,,,,,,,,,,,,Sí,,,,,,https://kf.kobotoolbox.org/api/v2/assets/aUw72KrDA2sRGCi7GuKuXD/data/604519105/attachments/attPFQtdKQoqf7Wmr6D2Vakk/,,096,096-Tijuana,89
12/11/2025,12/11/2025,12/11/2025,Tijuana,mujer,47,,Tejido a mano,Tejido tradicional,,Luchbil,Tsotsil,,Chiapas,Larráinzar,,se_realiza_a_mano,1,0,0,0,0,0,0,,No,,0,0,0,0,,es_una_t_cnica_antigua,Son las creencias de los antepasados,Hilo de algodón y de lana y sus herramientas como machete etc,madre,1,0,0,0,0,0,0,0,,a_hijos,0,0,0,0,0,0,0,1,,Huipiles,Cojines,Bolsas,Camino de mesa,Blusa bordadas,,,,,,En ceremonias,,,,,,,,,,,,,,,,Sí,El mundo,El mono,Flores,Caminante,Mariposas,https://kf.kobotoolbox.org/api/v2/assets/aUw72KrDA2sRGCi7GuKuXD/data/604519246/attachments/attG4Yv6KxKJTpdxLyTn48nt/,,097,097-Tijuana,90
12/11/2025,12/11/2025,12/11/2025,Tijuana,mujer,25,,Telar de cintura,Telar de cintura,,Jolobil,Mixteco,Tzotzil,Chiapas,Pantelhó,,se_realiza_a_mano,1,0,0,0,0,0,0,,No,,0,0,0,0,,es_una_t_cnica_antigua,Mi suegra me enseñó a través de los años,"Machete, palos de escoba, barritas del monte y milpas",otra,0,0,0,0,0,0,1,0,Suegra,si__a_otra_persona,0,0,0,0,0,0,1,0,Su abuela y mamá,Blusas,Poncho,Capa,Vestidos,Mañanitas,Tortilleros,Juegos individuales,Fundas de cojines,Porta vasos,Chalinas,Fiestas tradicionales,Blusas o vestidos,Bodas,Traje de hombre ceremonial,,,,,,,,,,,,,Sí,Animales,Figuras,Huella de jaguar,Estrella fugaz,Sapo,https://kf.kobotoolbox.org/api/v2/assets/aUw72KrDA2sRGCi7GuKuXD/data/604519312/attachments/att8WS6AedC2T7usohN2ESYm/,,098,098-Tijuana,91
12/11/2025,12/11/2025,12/11/2025,Tijuana,mujer,60,,Bordado a mano,Trencilla,,Bordado masahua,Mazahua,,México,San Felipe del Progreso,El Fresno nichi,es_una_t_cnica_mixta,0,0,0,1,0,0,0,,Sí,te_ido_con_plantas__ejem__muicle__peric_,1,0,0,0,Bicarbonato alumbre limón jabón gas o leña,es_una_t_cnica_antigua,,,madre abuela,1,1,0,0,0,0,0,0,,a_hijos s__a_una_pareja,0,0,0,0,1,0,0,1,,Tela de lana natural blanca,Qesqemels,Rebosos,Gabanes,Morrales,Chalecos,Abrigos,Caminos para mesa,Chamarras,Colchas etc.,Bodas,,Graduaciones,,Navideños,,Bautizos,,,Cumpleaños,,,Para regalos,,,,Sí,Tradiciones,Costumbre,,,,https://kf.kobotoolbox.org/api/v2/assets/aUw72KrDA2sRGCi7GuKuXD/data/604519430/attachments/attWhgYXeABtwTWPd6JJVuNw/,,099,099-Tijuana,92
12/11/2025,12/11/2025,12/11/2025,Tijuana,mujer,71,,Telar de cintura,Telar de cintura,,,Purépecha,,Michoacán de Ocampo,Paracho,Ahuira,otra,0,0,1,0,0,0,0,,Sí,te_ido_con_plantas__ejem__muicle__peric_ te_ido_con_sales_y_minerales__ejem__alum,1,1,0,0,"Cascaras, sales minerales",es_una_t_cnica_antigua,,,madre abuela,1,1,0,0,0,0,0,0,,s__a_mis_hijas_o_hijos a_hijos s__a_mis_nietas_o_nietos s__a_mis_sobrinas_o_sobrinos,0,1,1,1,0,0,0,1,,Rebozos,Chalecos,Vestidos,Jorongo,Gabanes,,,,,,Robozo para diario,,Vestido para el diario o fiestas,,Jorongo tiempo frio,,Gabanes para fiesta,,,,,,,,,,Sí,,,,,,,,100,100-Tijuana,93
12/11/2025,12/11/2025,12/11/2025,Tijuana,mujer,31,,Bordado a mano,Relleno,,Tzisbil ta kabal,Tseltal,,Chiapas,Venustiano Carranza,Aguacatenango,se_realiza_a_mano,1,0,0,0,0,0,0,,No,,0,0,0,0,,es_una_t_cnica_antigua,,,madre,1,0,0,0,0,0,0,0,,s__a_mis_hijas_o_hijos,0,1,0,0,0,0,0,0,,Blusas,Vestidos,Camisas p hombre,Batas,,,,,,,,,,,,,,,,,,,,,,,Sí,Naturaleza,,,,,https://kf.kobotoolbox.org/api/v2/assets/aUw72KrDA2sRGCi7GuKuXD/data/604520820/attachments/attKwbWptrBoWyC4tM7xHoSr/,,115,115-Tijuana,106
12/11/2025,12/11/2025,12/11/2025,Tijuana,mujer,64,enriquetacenobio_25@outlook.com,Bordado a mano,Lomillo,,Lomillo,Mazahua,,México,Villa de Allende,San Felipe Santiago,se_realiza_a_mano,1,0,0,0,0,0,0,,Sí,te_ido_con_plantas__ejem__muicle__peric_,1,0,0,0,"Bolitas de la bara corriosa, cáscara de nogal, fruta silvestre como la cachisda, feuta como el chapulín, alumbre, flor amarilla de rio, flor de árnica, flor de acahual, flor silvestre del gatito, pericon. Flor de cantu es.,",es_una_t_cnica_antigua,"Técnica del lomillo es utilizada para la representación de la cultura Mazahua, con esta técnica se realiza el diseño de la flor Mazahua que representa los 4 puntos cardinales, así como también se realiza el diseño del venado y que también nos representa, pues Mazahua significa gente del venado. Además de que con la técnica de lomillo se realizan varios diseños de iconografía que nos dan identidad como Mazahua.","Aguja, hilo de algodón o lana tejida en tintes naturales. Manta de algodón o tela de lana.",madre,1,0,0,0,0,0,0,0,,s__a_mis_hijas_o_hijos a_hijos s__a_mis_nietas_o_nietos s__a_mis_sobrinas_o_sobrinos s__a_una_pareja,0,1,1,1,1,0,0,1,,Camisas para caballero,En blusas,Rebozos,Portavasos,Fajas,Manteles,Ruedos para la enagua en eventos,Aretes,Pulceras,Separadores para libros,En fiestas del pueblo,,Fiestas patronales,,En las fiestas de los santos del pueblo,También los utilizan para cubrir la cabeza de las virgencitas de la iglesia,Son para cubrir la copa del vino de los padres en la iglesia,,Son utilizadas para las señoras,,"Los manteles los usan para ceremonias del pueblo, como cuando hacen cambio de mayordomos",,Se usaba para las bodas,,Los utilizan en bodas,,Sí,Con la técnica de lomillo se elabora la flor Mazahua que representa los 4 puntos cardinales,,,,,https://kf.kobotoolbox.org/api/v2/assets/aUw72KrDA2sRGCi7GuKuXD/data/604519675/attachments/attkv55eMyBGihFtWsJs8dug/,,101,101-Tijuana,94
28/11/2025,28/11/2025,28/11/2025,CDMX,mujer,,,,Punto de Cruz,Punto de cruz,,Purépecha,,Michoacán de Ocampo,Coeneo,,se_realiza_a_mano,1,0,0,0,0,0,0,,No,,0,0,0,0,,es_una_t_cnica_antigua,,,hermana,0,0,0,0,1,0,0,0,,s__a_mis_hijas_o_hijos,0,1,0,0,0,0,0,0,,Camisas,Guanengos bolsas,Mandiles,,,,,,,,Seremonias,,,,,,,,,,,,,,,,No,,,,,,,,036,036-CDMX,36
12/11/2025,12/11/2025,12/11/2025,Tijuana,mujer,39,,Tejido a mano,Tejido tradicional,,,Zapoteco,,Oaxaca,Heroica Ciudad de Juchitán de Zaragoza,Juchitán de Zaragoza,se_realiza_a_mano,1,0,0,0,0,0,0,,No,,0,0,0,0,,es_una_t_cnica_antigua,,"Hilos de algodón, aguja de gancho",madre t_a,1,0,1,0,0,0,0,0,,si__a_otra_persona,0,0,0,0,0,0,1,0,A una tía,"Un traje, que consta de un huipil y dos lienzos que conforman una falda y que al pie lleva un olan",Huipil o blusa,Manteles,Camino de mesa,Guayaberas,Fundas para almohada,Cojines,Huaraches,Zapatillas,,Cuando la persona es anfitriona del evento o fiestas tradicionales del pueblo,,En fiestas o eventos,,Artículo de decoración para el hogar,,Artículo de decoración para el hogar,,Fiestas o eventos relevantes,,Artículo de decoración para el hogar,,Artículo de decoración para el hogar,,Para uso personal,,No,,,,,,https://kf.kobotoolbox.org/api/v2/assets/aUw72KrDA2sRGCi7GuKuXD/data/604519780/attachments/attr89xrcbszduL2TNZjzgLM/,,102,102-Tijuana,95
12/11/2025,12/11/2025,12/11/2025,Tijuana,mujer,57,,Bordado a mano,Hilván,,,,,Oaxaca,San Martín Tilcajete,,se_realiza_a_mano,1,0,0,0,0,0,0,,Sí,te_ido_con_plantas__ejem__muicle__peric_,1,0,0,0,"Pericón, cempasúchil y añil",es_una_t_cnica_antigua,"El vestido de bodas cuando la novia lo usa, los hazme si puedes son el número de hijos que va a amamantar",,madre abuela,1,1,0,0,0,0,0,0,,s__a_mis_sobrinas_o_sobrinos,0,0,0,1,0,0,0,0,,Vestido tradicional,,,,,,,,,,"Guelaguetza, mayordomías, calendas.",,,,,,,,,,,,,,,,Sí,El número de hijos a amamantar,,,,,https://kf.kobotoolbox.org/api/v2/assets/aUw72KrDA2sRGCi7GuKuXD/data/604519793/attachments/attDyVZ6DDt9tjobzzQdXZDZ/,,103,103-Tijuana,96
12/11/2025,12/11/2025,12/11/2025,Tijuana,mujer,36,,Telar de cintura,Telar de cintura,,Tlakitl,Náhuatl,,Puebla,Zacatlán,Cuacuila,otra,0,0,1,0,0,0,0,,Sí,otro,0,0,0,1,"Añil , tinta de ácido",es_una_t_cnica_antigua,"Historia , pedida de mano a la novia",Lana,de_una_maestra_o_instructora,0,0,0,0,0,1,0,0,Compañera de labor,si__a_otra_persona,0,0,0,0,0,0,1,0,Entre las compañeras del grupo,Lienzo de la vestimenta tradicional,Morrales,Quexquémetl,Rebozo,Chalecos,,,,,,Danza del maiz,,,,,,,,,,,,,,,,Sí,"Pedida de mano , rescate de tradiciones y costumbres",,,,,https://kf.kobotoolbox.org/api/v2/assets/aUw72KrDA2sRGCi7GuKuXD/data/604520012/attachments/attPu7TnpnmmQpJkcezF3caX/,,104,104-Tijuana,97
12/11/2025,12/11/2025,12/11/2025,Tijuana,mujer,40,,Bordado a mano,Cadeneta o cadenilla,,,Mixteco,,Oaxaca,Santiago Pinotepa Nacional,Pinotepa nacional,se_realiza_a_mano,1,0,0,0,0,0,0,,No,otro,0,0,0,1,,es_una_t_cnica_antigua,Se usaba en la raza indígena para casarse,"Hilos ,aguja,telar de cintura y listones",madre,1,0,0,0,0,0,0,0,,a_hijos,0,0,0,0,0,0,0,1,,Huipil,Camisa,,,,,,,,,En bodas,,Fiestas patronal,,Homenaje cívicos de las escuela,,,,,,,,,,,,Sí,Representa la unión de un matrimonio,Representa también la flora y la fauna de mi localidad,,,,https://kf.kobotoolbox.org/api/v2/assets/aUw72KrDA2sRGCi7GuKuXD/data/604520045/attachments/att4fbdQbSWmDNj2PZir4H2X/,,105,105-Tijuana,98
12/11/2025,12/11/2025,12/11/2025,Tijuana,mujer,42,,Bordado a mano,Punto de Cruz,,,Tepehuano del Sur,,Durango,Mezquital,,se_realiza_a_mano,1,0,0,0,0,0,0,,No,,0,0,0,0,,es_una_t_cnica_antigua,,"Cuadrille, estambres, agujas de coser",madre,1,0,0,0,0,0,0,0,,s__a_mis_hijas_o_hijos,0,1,0,0,0,0,0,0,,Algodón,,,,,,,,,,Costumbre xiota,,,,,,,,,,,,,,,,Sí,Costumbre y tradición,Recuerdos de mis antepasados,,,,https://kf.kobotoolbox.org/api/v2/assets/aUw72KrDA2sRGCi7GuKuXD/data/604520111/attachments/attkByNjQ9Lr6Hd52peY9Rz2/,,106,106-Tijuana,99
12/11/2025,12/11/2025,12/11/2025,Tijuana,mujer,46,,Bordado a mano,Punto de Cruz,,Wuo,Chinanteco,,Oaxaca,San Felipe Usila,,se_realiza_a_mano otra,1,0,1,0,0,0,0,,No,,0,0,0,0,,es_una_t_cnica_antigua,"Tiene o flor del guayabo que representa la virginidad de la mujer, la pechera representa los 4 puntos cardinales y las 4 estaciones del año. Los escalones que pasan las almas para llegar a su lugar de descanso, tiene la flor del sol porque el clima es caluroso y tiene la flor de Quetzalcóatl","Hilo de Algodón, industrial",madre abuela,1,1,0,0,0,0,0,0,,s__a_mis_hijas_o_hijos s__a_mis_sobrinas_o_sobrinos si__a_otra_persona,0,1,0,1,0,0,1,0,Nuera y vecina,En huipiles,Servilletas,Rebozos,Recuerdos,Camino de mesa,Camisa,Blusas,,,,Huipil,Boda,Señidor,Boda,Huipiles,Bautizos,,,,,,,,,,,Sí,La flor del guayabo la virginidad de la mujer,,,,,https://kf.kobotoolbox.org/api/v2/assets/aUw72KrDA2sRGCi7GuKuXD/data/604520430/attachments/attpwktskdWYM7t8PA3yyEu4/,,107,107-Tijuana,100
12/11/2025,12/11/2025,12/11/2025,Tijuana,mujer,36,,Bordado a mano,Cadeneta o cadenilla,,Xuyëë,Mixe,,Oaxaca,San Juan Guichicovi,El Ocotal,se_realiza_a_mano se_realiza_a_m_quina_de_pedal,1,1,0,0,0,0,0,,No,,0,0,0,0,,es_una_t_cnica_antigua,,"Máquina de pedal, agujas, hilo mercerizado, telas comerciales, lienzos de telar de mitla.",madre,1,0,0,0,0,0,0,0,,s__a_una_pareja,0,0,0,0,1,0,0,0,,"Vestido, blusas",Huipiles,Guayaberas,Playeras,,,,,,,Boda,Vestido / trajes tradicionales,,,,,,,,,,,,,,,Sí,"Objetos que nos rodean,","Símbolos, peine, JICARITA, coralito, centavo, araña",,,,https://kf.kobotoolbox.org/api/v2/assets/aUw72KrDA2sRGCi7GuKuXD/data/604520497/attachments/att94VxwswSdKCguAh6G7KaL/,,108,108-Tijuana,101
12/11/2025,12/11/2025,12/11/2025,Tijuana,mujer,48,"Ilban, lomillo y punto de cruz",Bordado a mano,Punto de Cruz,,"Inkini, lomillo y punto de cruz",Otomí,,Querétaro,Amealco de Bonfil,"San Idelfonso Tultepec, Amealco",se_realiza_a_mano,1,0,0,0,0,0,0,,No,,0,0,0,0,,es_una_t_cnica_antigua,"Los bordados tradicionales se crea para la vestimenta tradicional, ocupando animales representativos de la región.","Hilos de algodón, mantan, linos, cuadrille, manta, etamina, linos de algodón.",madre abuela t_a,1,1,1,0,0,0,0,0,,s__a_mis_sobrinas_o_sobrinos s__a_estudiantes si__a_otra_persona,0,0,0,1,0,1,1,0,,Trajes tradicionales,Servilletas,Caminos de mesa,Muñecas Lele,Donchu,,,,,,En trajes tradicionales para la mayordomía de la localidad,,Fiestas patronales,,Fiestas ceremoniales,,Danzas tradicionales,,,,,,,,,,Sí,Representan a la naturaleza de la región,,,,,https://kf.kobotoolbox.org/api/v2/assets/aUw72KrDA2sRGCi7GuKuXD/data/604520646/attachments/attnWxkA3B9voWusmi6cSy3N/,,109,109-Tijuana,102
12/11/2025,12/11/2025,12/11/2025,Tijuana,hombre,39,,Telar de pedal,Telar de pedal,,,,,Oaxaca,Oaxaca de Juárez,,otra,0,0,1,0,0,0,0,,Sí,te_ido_con_plantas__ejem__muicle__peric_ te_ido_con_con_insectos_y_animales__ejem,1,0,1,0,,es_una_t_cnica_nueva,El grana cochinilla es una historia que los dioses dela región Mixteca ocupaban la tinta para su teñidos y también para escribir un mesaje o aviso informativo para la población,Hilos de algodón,hermana,0,0,0,1,0,0,0,0,,s__a_mis_hijas_o_hijos,0,1,0,0,0,0,0,0,,Rebosos,Caminos de mesa,Cojines,Colchas,Servilletas,Manteles,,,,,Boda,,Eventos,,Hoteles,,Restaurante,,Diseñadores,,Recuerda para 15 años,,,,,,Sí,Son tejidos artesanales,El arte del textil,Moda artesanal,Rescatar artesanal,,https://kf.kobotoolbox.org/api/v2/assets/aUw72KrDA2sRGCi7GuKuXD/data/604520676/attachments/attWdZNeGcFRGUyEg8udMuDJ/,,110,110-Tijuana,103
12/11/2025,12/11/2025,12/11/2025,Tijuana,mujer,51,,Bordado a mano,Punto atrás,,"Indú Ndenajñu,Indú Maya , Indú Mangangui",Mazateco,Mazateco,Oaxaca,San Bartolomé Ayautla,,se_realiza_a_mano,1,0,0,0,0,0,0,,No,,0,0,0,0,,es_una_t_cnica_antigua,Cada ave significa algo para comunidad,"Aguja, manta, lino, etamina",t_a,0,0,1,0,0,0,0,0,,a_hijos s__a_mis_sobrinas_o_sobrinos,0,0,0,1,0,0,0,1,,Huipil,Enagua,Vestido de novia,Ropaje de bautizo,,,,,,,Bautizo,,Bodas,,XV años,,,,,,,,,,,,Sí,Las aves significan los miembros de la familia,El árbol de la vida es donde se pone las aves y las flores,,,,https://kf.kobotoolbox.org/api/v2/assets/aUw72KrDA2sRGCi7GuKuXD/data/604520731/attachments/attAcPc5kWYBtNgD3w6wfnQG/,,111,111-Tijuana,104
12/11/2025,12/11/2025,12/11/2025,Tijuana,mujer,51,,Bordado a mano,Relleno,,"Indú Ndenajñu,Indú Maya , Indú Mangangui",Mazateco,Mazateco,Oaxaca,San Bartolomé Ayautla,,se_realiza_a_mano,1,0,0,0,0,0,0,,No,,0,0,0,0,,es_una_t_cnica_antigua,Cada ave significa algo para comunidad,"Aguja, manta, lino, etamina",t_a,0,0,1,0,0,0,0,0,,a_hijos s__a_mis_sobrinas_o_sobrinos,0,0,0,1,0,0,0,1,,Huipil,Enagua,Vestido de novia,Ropaje de bautizo,,,,,,,Bautizo,,Bodas,,XV años,,,,,,,,,,,,Sí,Las aves significan los miembros de la familia,El árbol de la vida es donde se pone las aves y las flores,,,,https://kf.kobotoolbox.org/api/v2/assets/aUw72KrDA2sRGCi7GuKuXD/data/604520731/attachments/attAcPc5kWYBtNgD3w6wfnQG/,,112,112-Tijuana,104
