start,end,Fecha,Sede,Genero,Edad,Notas,tecnica_grupo,Tecnica,Descripción,Tecnica_lengua,Lengua,Lengua_nota,Estado,Municipio,Localidad,Manufactura,Mano,Pedal,Telar,Mixta,Otra,Tejido,Telar_pedal,Manufactura_especifique,Tenido,Tipo_tenido,Plantas,Minerales,Animales,Otro,Tenido_especifique,Temporalidad,Historia,Materiales,Aprendizaje,Madre,Abuela,Tia,Hermana,Cunada,Instructora,Aprendi_otro,Padre,Aprendizaje_especifique,Ensenanza,No_ensenado,Hijas,Nietos,Sobrinos,Pareja,Estudiantes,Enseno_otra,Hijos,Ensenar_especifique,pr1,pr8,pr2,pr4,pr10,pr9,pr3,pr5,pr7,pr6,c6,cm7,c3,cm3,c7,cm5,c4,cm4,c1,cm1,c2,cm2,c8,cm8,c5,cm6,Significado,S1,S2,S3,S4,S5,pic,video,index,concat_id,_index
15/10/2025,15/10/2025,15/10/2025,Mérida,mujer,25,,Telar de cintura,Telar de cintura,,Jolom! Ta patil,Tsotsil,,Chiapas,Larráinzar,,otra,0,0,1,0,0,0,0,,No,te_ido_con_plantas__ejem__muicle__peric_ te_ido_con_sales_y_minerales__ejem__alum te_ido_con_con_insectos_y_animales__ejem,1,1,1,0,,es_una_t_cnica_antigua,,"Hilos, rodillos machete bastidor para  fijar el telar",madre abuela,1,1,0,0,0,0,0,0,,no_la_he_ense_ado,1,0,0,0,0,0,0,0,,Blusas,Huipiles,Fajas,Rebosos,Gabanes,Monederos,Bolsas,Fundas para cogin,Pulceras,Collares,Boda,,Para ceremonias espirituales,,Para recibir algún cargo de la comunidad,,,,,,,,,,,,Sí,Del universo,Representa los animales,,,,https://kc.kobotoolbox.org/media/original?media_file=unescomx%2Fattachments%2F218b423bdd044378b9a7377d784ae06f%2F3a98c070-7b76-4072-b25b-37675743a409%2F20250609_174834-15_40_0.jpg,https://kc.kobotoolbox.org/media/original?media_file=unescomx%2Fattachments%2F218b423bdd044378b9a7377d784ae06f%2F3a98c070-7b76-4072-b25b-37675743a409%2FFB_VID_1712322225676153745-15_44_52.mp4,141,141-Mérida,139
15/10/2025,15/10/2025,15/10/2025,Mérida,mujer,28,Pasar en el están  por más fotos,Telar de cintura,Telar de cintura,,Jolobil,Tsotsil,,Chiapas,Larráinzar,Oventic,,0,0,0,0,0,0,0,,No,,0,0,0,0,,es_una_t_cnica_antigua,,Hilos de algodón,madre,1,0,0,0,0,0,0,0,,no_la_he_ense_ado,1,0,0,0,0,0,0,0,,Hupil,Reposo,Monederos,Portavaso,,,,,,,Los alcaldes,,,,Bodas,,,,,,,,,,,,Sí,Los rombos es el centro del universo,,,,,,,142,142-Mérida,140
15/10/2025,15/10/2025,15/10/2025,Mérida,mujer,38,,Telar de cintura,Telar de cintura,,Jolom,Tsotsil,,Chiapas,Larráinzar,Luquilo,otra,0,0,1,0,0,0,0,,No,,0,0,0,0,,es_una_t_cnica_antigua,Ranas de la fertilidad,Algodón,madre,1,0,0,0,0,0,0,0,,s__a_mis_hijas_o_hijos,0,1,0,0,0,0,0,0,,Huipil,Camino de mesa,Servilletas,,,,,,,,Fiestas tradicionales,,Autoridades,,,,,,,,,,,,,,No,Ranas,Hombre y mujer,Rombo,Alacrán,,https://kc.kobotoolbox.org/media/original?media_file=unescomx%2Fattachments%2F218b423bdd044378b9a7377d784ae06f%2Fb120eb1d-396d-4ec3-adc2-027888f04951%2F1760565052260728185390224260079-15_51_4.jpg,,150,150-Mérida,148
15/10/2025,15/10/2025,15/10/2025,Mérida,mujer,54,,Bordado a mano,Punto de Cruz,,Otros bordados técnica de uruapan,,,Michoacán de Ocampo,Uruapan,Uruapan Michoacán,se_realiza_a_mano otra,1,0,1,0,0,0,0,,No,,0,0,0,0,La manta ya se compra teñida,es_una_t_cnica_antigua,Indumentaria tradicional,Manta e hilos de algodón,madre de_una_maestra_o_instructora,1,0,0,0,0,1,0,0,,s__a_mis_hijas_o_hijos,0,1,0,0,0,0,0,0,,Blusa,Reboso,Guanengos,Faldas mandiles,Servilletas manteles,,,,,,Traje de gala para eventos especiales,,Para celebraciones tradicionales de los barrios,,Rituales tradicionales de mi comunidad Uruapan Michoacán,,,,,,,,,,,,Sí,,,,,,https://kc.kobotoolbox.org/media/original?media_file=unescomx%2Fattachments%2F218b423bdd044378b9a7377d784ae06f%2Fa3118f5d-d0ef-40c5-b9e7-fa516d1575e5%2F17605648522838805434451189001871-15_48_15.jpg,,143,143-Mérida,141
15/10/2025,15/10/2025,15/10/2025,Mérida,mujer,36,Pasar al estánd por la fotos,Telar de cintura,Telar de cintura,,Tajquit,,Náhuatl,Puebla,Cuetzalan del Progreso,Cuetzalan del progreso,otra,0,0,1,0,0,0,0,,No,,0,0,0,0,,es_una_t_cnica_antigua,Telar de cintura es la fuente principal para la elaboración de la tela para poder crear la vestimenta propia de región anteriormente no se usaban blusas con tela industrial todo era elabora por medio del hílado del algodón y tejido,Algodón,madre abuela,1,1,0,0,0,0,0,0,,s__a_mis_hijas_o_hijos si__a_otra_persona,0,1,0,0,0,0,1,0,"Amigas, gente interesada en la técnica",Huipiles,Rebozos,Blusas,Fajas,Servilletas,Camino de mesas,Monederos-paltel-náhuatl,Bufandas,Chalinas,Colchas,"Para vestir diario dependen del tejido que se realize ya que hay variedad en este caso se usan para bodas, fiestas de galas, o de diario",,Usan para cubrirse del frio,,Para vestir diario,,Parte de la vestimenta del traje regional y se usa diario y lleva un bordado en espefico para que sea de gala,,Para cubrir las tortillas que molemos a diario,,Sufrió un innovación y se utiliza para adornar la mesa,,Para guardar nuestro dinero,,Cubrir el cuello,,Sí,Sali- es de dos varas este diseño lo realizó la virgen Maria esas eran las creencias,ixyehualiwik es de Cocolito este tejido fue creado por la virgen María,Ixmatzal es de 3 baras o tres xiyot está técnica lo creo que diablo se creía que el era el mejor de todos,,,,,144,144-Mérida,142
15/10/2025,15/10/2025,15/10/2025,Mérida,mujer,43,,Bordado a mano,Lomillo,,Lomillo,Mazahua,,México,San Felipe Santiago,San Felipe Santiago municipio Villa de Allende,se_realiza_a_mano,1,0,0,0,0,0,0,,Sí,te_ido_con_plantas__ejem__muicle__peric_,1,0,0,0,,es_una_t_cnica_antigua,Bordado de nuestras tatarabuelas,"Manta ,tela de lana, estambre,hilos",madre,1,0,0,0,0,0,0,0,,s__a_mis_hijas_o_hijos,0,1,0,0,0,0,0,0,,Camisas,Blusas,Quesquemetl,Separadores de libros,Pulseras,Morrales,Manteles,Rebozos,Cuadro para enmarcar,Vestido,Vestido,Boda,Camisa,Boda,Atuendo,Bautizo,,,,,,,,,,,Sí,Iconografía de la naturaleza,,,,,https://kc.kobotoolbox.org/media/original?media_file=unescomx%2Fattachments%2F218b423bdd044378b9a7377d784ae06f%2Fa39712ed-4098-43e7-bfb8-c08acd871784%2FScreenshot_2025-10-15-15-44-03-460_com.whatsapp-15_50_3.jpg,,145,145-Mérida,143
16/10/2025,16/10/2025,15/10/2025,Mérida,mujer,61,,Bordado a mano,Lomillo,,Renamni,Otomí,,Hidalgo,Cardonal,,se_realiza_a_mano,1,0,0,0,0,0,0,,No,,0,0,0,0,,es_una_t_cnica_antigua,Cree que comparte orígenes con el hilván y el pepenado,"Hilos de madeja, de algodón o de seda",madre abuela,1,1,0,0,0,0,0,0,,s__a_mis_hijas_o_hijos s__a_mis_nietas_o_nietos s__a_estudiantes,0,1,1,0,0,1,0,0,,Blusa,Camisa,Faldas,Rebozos,,,,,,,Boda,Vestidos,,,,,,,,,,,,,,,Sí,Representa elegancia,,,,,,,199,199-Mérida,196
15/10/2025,15/10/2025,15/10/2025,Mérida,mujer,46,,Bordado a máquina,Sombreado,,Chuy yéetel máquina de pedal,Maya Yucateco,,Yucatán,Teabo,,se_realiza_a_m_quina_de_pedal,0,1,0,0,0,0,0,,No,,0,0,0,0,,es_una_t_cnica_antigua,El sonbriado es la prenda que usaba la gente trabajadora en las aciendas mientras los dueños de las aciendas usaban el  punto de cruz,Hilos de alta ceda,madre abuela,1,1,0,0,0,0,0,0,,no_la_he_ense_ado,1,0,0,0,0,0,0,0,,Hipil,Blusa,Guayabera,Enmarcados,Camisa,Paliacates,Bolsos,,,,Fiestas regionales,,XV años,,Bodas religiosas,,Vaquerías,,,,,,,,,,Sí,Es significativa por ser la primera técnica que aprendió la artesana,,,,,https://kc.kobotoolbox.org/media/original?media_file=unescomx%2Fattachments%2F218b423bdd044378b9a7377d784ae06f%2F59ba5898-3ac7-4e97-ab1e-adec27eccaf9%2F1000209994-15_50_13.jpg,,146,146-Mérida,144
15/10/2025,15/10/2025,15/10/2025,Mérida,mujer,26,,Telar de cintura,Telar de cintura,,Ikitke,,Náhuatl,Veracruz de Ignacio de la Llave,Soledad Atzompa,Tepexpan,otra,0,0,1,0,0,0,0,,Sí,te_ido_con_plantas__ejem__muicle__peric_ te_ido_con_con_insectos_y_animales__ejem,1,0,1,0,,es_una_t_cnica_antigua,"Anteriormente se utilizaba principalmente en su vestimenta, mas para las mujeres. En la actualidad ya solo se usa alguna prenda de este telar de cintura de lana de borrego de vez en cuando","Lana de borreo, los palitos para hacer el telar de cintura y los materiales  para teñir  en caso de querer agregarle color.",madre,1,0,0,0,0,0,0,0,,no_la_he_ense_ado,1,0,0,0,0,0,0,0,,Kechkemit,Rebozo,Jorongos,Morrales,Fufandas,,,,,,,,,,,,,,,,,,,,,,Sí,"Significa la enseñanza  de nuestros  antepasados, especialmente a las abuelitas...",,,,,https://kc.kobotoolbox.org/media/original?media_file=unescomx%2Fattachments%2F218b423bdd044378b9a7377d784ae06f%2Fe5a1e3cc-9016-4cc2-b00e-66cf8ad5d467%2F20250131_124058-14_53_53.jpg,,147,147-Mérida,145
15/10/2025,15/10/2025,15/10/2025,Mérida,mujer,35,,Bordado a mano,Punto de Cruz,,Punto de cruz,Totonaco,,Puebla,Atlequizayan,Atlequizayán,se_realiza_a_mano,1,0,0,0,0,0,0,,No,,0,0,0,0,,es_una_t_cnica_antigua,,,madre abuela,1,1,0,0,0,0,0,0,,no_la_he_ense_ado,1,0,0,0,0,0,0,0,,Blusas,Huipil,Servilletas,,,,,,,,,,,,,,,,,,,,,,,,No,,,,,,https://kc.kobotoolbox.org/media/original?media_file=unescomx%2Fattachments%2F218b423bdd044378b9a7377d784ae06f%2Fc12403cd-316f-4090-82c2-ce047984067f%2F1000376182-15_50_49.jpg,,148,148-Mérida,146
15/10/2025,15/10/2025,15/10/2025,Mérida,mujer,27,"En este stand se va a encontrar piezas de calidad hechos por manos de mujeres, hombres al igual niños artesanos.",Bordado a mano,Punto de Cruz,,Xocbil Chuy,Maya Yucateco,,Yucatán,Hoctún,San José Oriente,se_realiza_a_mano,1,0,0,0,0,0,0,,Sí,otro,0,0,0,1,,es_una_t_cnica_antigua,"Antiguamente, se utilizaba una técnica de bordado sobre tela. Con la llegada de la malla, se comenzó a bordar los hipiles sobre este material. Se dice que quienes dominan el arte de crear diseños únicos poseen el secreto de ""agarrar la espalda de la serpiente Och Kan"".","Hilo de colores de tres hebras, maya, caneva, tela, y sobre todo la aguja.",madre abuela,1,1,0,0,0,0,0,0,,s__a_mis_hijas_o_hijos si__a_otra_persona,0,1,0,0,0,0,1,0,,Hipil,Terno,Pañal,Blusas,Diseños personalizados,"Recuerdos de boda, XV años, bautizo,  jes mek'",Pañales,Servilleteros,"Collar, diadema, pulseras etc",Fundas,Boda,,Bautizo,,Fiesta tradicional,,XV años,,,,,,,,,,Sí,Amor al trabajo hecho a mano.,Cada puntada está hecho con amór,Significa un legado cultural que y no quiero que se pierda,,,https://kc.kobotoolbox.org/media/original?media_file=unescomx%2Fattachments%2F218b423bdd044378b9a7377d784ae06f%2Ffd32f322-5f0e-4da6-880c-c8ac81fc368a%2F1000156537-15_49_7.jpg,,149,149-Mérida,147
15/10/2025,15/10/2025,15/10/2025,Mérida,mujer,27,,Telar de cintura,Brocado,,Jolobil xchiúk sluchal,Tsotsil,,Chiapas,Pantelhó,,otra,0,0,1,0,0,0,0,,No,,0,0,0,0,,es_una_t_cnica_antigua,"El significado de los brocados como el sapo y la rana son los invocadores del agua, La huella del perro son los protectores en las noches","Se utilizan Hilos, la madera para el Hurdimbre, al momento de tejer se usa el machete de tejer y los palitos del armamento",madre,1,0,0,0,0,0,0,0,,no_la_he_ense_ado,1,0,0,0,0,0,0,0,,Huipiles,Rebozos,Servilletas,Blusas,,,,,,,Blusas en uso diario,,Blusas de gala en las fiestas del pueblo,,Huipiles largos en algún evento del pueblo,,,,,,,,,,,,Sí,Brocados del Sapo y rana son los invocadores del agua,La huella del perro son los cuidadores de la noche,,,,https://kc.kobotoolbox.org/media/original?media_file=unescomx%2Fattachments%2F218b423bdd044378b9a7377d784ae06f%2F2722d284-ebce-4cb3-b0af-5181d961e8dd%2FIMG_20250928_122956-15_50_57.jpg,,151,151-Mérida,149
15/10/2025,15/10/2025,15/10/2025,Mérida,mujer,34,,Bordado a mano,Punto de Cruz,,Xocbil Chuuy,Maya Yucateco,,Yucatán,Teabo,,se_realiza_a_mano,1,0,0,0,0,0,0,,No,,0,0,0,0,,es_una_t_cnica_antigua,Historia,"Tela de lino y algodón, caneva, agujas hilo de algodón, tijeras",madre abuela,1,1,0,0,0,0,0,0,,s__a_mis_sobrinas_o_sobrinos s__a_estudiantes,0,0,0,1,0,1,0,0,,Blusas,Vestidos,Hipiles,Ternos,Guayaberas,Pañuelos,,,,,Bautizo,,Primera comunión,,Bodas,,,,,,,,,,,,Sí,Técnicas ancestrales con significativos,Técnicas rescatadas de nuestros antepasados con generaciones,Las imágenes de las puntadas representan significados en las imágenes,,,https://kc.kobotoolbox.org/media/original?media_file=unescomx%2Fattachments%2F218b423bdd044378b9a7377d784ae06f%2F32008fc9-22ee-4546-baac-cfe01526ed00%2F1000396222-15_51_7.jpg,,152,152-Mérida,150
15/10/2025,15/10/2025,15/10/2025,Mérida,mujer,59,Sin celular propio. Contacto de la hermana menor.,Bordado a máquina,Renacimiento,,No,,,Yucatán,Maní,,se_realiza_a_m_quina_de_pedal,0,1,0,0,0,0,0,,No,,0,0,0,0,,es_una_t_cnica_antigua,No,"Tela de algodón, hilos y el aro.",madre,1,0,0,0,0,0,0,0,,s__a_mis_sobrinas_o_sobrinos si__a_otra_persona,0,0,0,1,0,0,1,0,Interesados de otras comunidades,Hipiles,Blusas,Solapas,,,,,,,,Bodas,Hipiles y ternos,Vaquerías,Hipiles y ternos,,,,,,,,,,,,,Sí,El oanal de las abejas,,,,,,,153,153-Mérida,151
15/10/2025,15/10/2025,15/10/2025,Mérida,mujer,21,Blusas,Telar de cintura,Kuil,,Kuil,Tsotsil,,Chiapas,Chenalhó,,,0,0,0,0,0,0,0,,No,,0,0,0,0,,es_una_t_cnica_antigua,Historia de nuestro uipil de pueblo chenalhó significa color de la madre tierra,Telar de cintura bordado a mano palos y agujas,abuela,0,1,0,0,0,0,0,0,,s__a_mis_hijas_o_hijos s__a_mis_sobrinas_o_sobrinos,0,1,0,1,0,0,0,0,,Tradicional se utiliza en fiestas cultural y tradicional,,,,,,,,,,Ceremoniales de santos patronales,,,,,,,,,,,,,,,,Sí,,,,,,https://kc.kobotoolbox.org/media/original?media_file=unescomx%2Fattachments%2F218b423bdd044378b9a7377d784ae06f%2F0f80b29d-f22b-4170-abab-b5706a668519%2F1000018876-15_50_58.jpg,,154,154-Mérida,152
15/10/2025,15/10/2025,15/10/2025,Mérida,mujer,54,,Bordado a mano,Punto de Cruz,,Xochbichul,Maya Yucateco,,Quintana Roo,Tulum,,se_realiza_a_mano,1,0,0,0,0,0,0,,No,,0,0,0,0,,es_una_t_cnica_antigua,Es la ropa mas tradicional que usaban nuestros abuelos,"Canepa, hilo algodón, tela, aguja",madre abuela,1,1,0,0,0,0,0,0,,s__a_estudiantes si__a_otra_persona,0,0,0,0,0,1,1,0,Niños y niñas de una comunidad,Blusas,Hipiles,Terno,Vestidos,,,,,,,Bodas,Hipiles,Eventos especiales,Ropa,Fiestas tradicionales,Ternos,Vaquerias,Ternos,,,,,,,,,Sí,Rombos mayas,Grecas mayas,Flores,Antiguos mayas,,https://kc.kobotoolbox.org/media/original?media_file=unescomx%2Fattachments%2F218b423bdd044378b9a7377d784ae06f%2Fcb084ecc-087f-49dd-b4ca-7ea8302c50da%2F1000942551-15_53_33.jpg,,157,157-Mérida,155
15/10/2025,15/10/2025,15/10/2025,Mérida,mujer,30,,Telar de cintura,Brocado,,Jolobil chiu'k luchal,Tsotsil,,Chiapas,Pantelhó,,otra,0,0,1,0,0,0,0,,No,,0,0,0,0,,es_una_t_cnica_antigua,"Pues de los brocados tienen un significado como por ejemplo, la rana y los sapos son los invocadores del agua, la huella del perro significa los protectores de la noches, el bracero eso significa la adoración de la imagenes, la estrella eso significa cuando ya llega la navidad cuentan en mi pueblo que hay una estrella muy grande eso es el nacimiento del niño jesús","Se utiliza hilos, una madera para el hurdimbre, se utiliza palos de escoba para montado,",madre,1,0,0,0,0,0,0,0,,si__a_otra_persona,0,0,0,0,0,0,1,0,Mis cuñadas,Huipiles largos,Blusas,Bufandas,Camino de mesa,Monederos,Bolsas,Rebosos,Fundas de cojines,Chalecos,Servilletas,Blusa tradicional se utiliza en la fiesta de carnaval,,"Blusa gala se utiliza en las fiestas como boda, bautizo",,,,,,,,,,,,,,Sí,Tradiciones,Herencia,,,,https://kc.kobotoolbox.org/media/original?media_file=unescomx%2Fattachments%2F218b423bdd044378b9a7377d784ae06f%2F81b38277-23ea-4081-9398-63c681043605%2F1000044398-15_51_28.jpg,,158,158-Mérida,156
15/10/2025,15/10/2025,15/10/2025,Mérida,mujer,34,"Vine de acompañante de Ana Luz Valdés Cano, pero yo hago bordado y ella tejido. Haber si hay oportunidad de venir para mostrar mi trabajo porque es muy diferente y no hay nadie de mi pueblo participando en este evento o alguna de mis parientes.",Bordado a mano,Punto de Cruz,,Sirïkukua,Purépecha,Purépecha,Michoacán de Ocampo,Nahuatzen,"Comachuén, Mich.",se_realiza_a_mano,1,0,0,0,0,0,0,,No,,0,0,0,0,,es_una_t_cnica_antigua,Se hacía para vestirse no para venta.,"Cuadrille, etamina, hilos y aguja",madre t_a,1,0,1,0,0,0,0,0,,s__a_mis_sobrinas_o_sobrinos,0,0,0,1,0,0,0,0,,Servilletas,Huanengo,Delantal,Enagua,Faja,Manteles,,,,,Bautizos,"En la indumentaria, servilletas",Bodas,"En la indumentaria, servilletas",Perdón “entrega de novias “,"En la indumentaria, servilletas",Fiestas patronales,En la indumentaria,Día de muertos,"En la indumentaria, servilletas",Compadrazgo,"En la indumentaria, servilletas",Uanhanchas,"En la indumentaria, servilletas, piezas para la virgen",Semana santa,En la indumentaria,Sí,Resistencia,Independencia económica,Dignidad,Desahogo,Identidad,https://kc.kobotoolbox.org/media/original?media_file=unescomx%2Fattachments%2F218b423bdd044378b9a7377d784ae06f%2Faa6684da-8626-4c48-b363-3106508456f4%2FIMG_1426-15_47_52.jpeg,,159,159-Mérida,157
15/10/2025,15/10/2025,15/10/2025,Mérida,mujer,44,,Telar de cintura,Brocado,,Holobil xpas,Tsotsil,,Chiapas,Zinacantán,,otra,0,0,1,0,0,0,0,,Sí,te_ido_con_plantas__ejem__muicle__peric_,1,0,0,0,,es_una_t_cnica_antigua,Se desarrolló para vestir,"Algodón, lana y acrilana",madre,1,0,0,0,0,0,0,0,,si__a_otra_persona,0,0,0,0,0,0,1,0,Hermana,Chal,Falda,Manteles,,,,,,,,Es de todos los días,,Cambia el tamaño del mantel en fiestas,,,,,,,,,,,,,,Sí,Brocados representan pirámides,,,,,https://kc.kobotoolbox.org/media/original?media_file=unescomx%2Fattachments%2F218b423bdd044378b9a7377d784ae06f%2F0f485622-5dcf-4689-9870-5b1c35909f5d%2F17605652528412445184403767970233-15_54_25.jpg,,160,160-Mérida,158
15/10/2025,15/10/2025,15/10/2025,Mérida,mujer,64,,Bordado a máquina,Cadeneta o cadenilla,,,Mixe,,Oaxaca,San Juan Guichicovi,San Juan Guichicovi,se_realiza_a_m_quina_de_pedal,0,1,0,0,0,0,0,,No,,0,0,0,0,,es_una_t_cnica_antigua,Es contemporánea porque usa la técnica ancestral.,"Utilizo  telar,tela industrial, hilo seda y una máquina de  pedal que se maneja con pies y mano.",madre,1,0,0,0,0,0,0,0,,si__a_otra_persona,0,0,0,0,0,0,1,0,"Hija,primas,sobrinas y algunas personas de la comunidad.",En trajes que se usa en las velas.,Huipiles.,Camisas.,Vestido.,Blusas.,Fundas,Bolsas.,Faldas.,,,Velas.,,Mayordomía.,,Bodas.,,Bautizo.,,,,,,,,,,Sí,Dependiendo de la figura que se hace tiene su significado.,,,,,https://kc.kobotoolbox.org/media/original?media_file=unescomx%2Fattachments%2F218b423bdd044378b9a7377d784ae06f%2F32277a2a-e71e-45c4-a915-fe68eb0d8423%2FIMG-20251015-WA0018-15_56_52.jpg,,163,163-Mérida,160
15/10/2025,15/10/2025,15/10/2025,Mérida,mujer,55,,Telar de cintura,Telar de cintura,,,Amuzgo,,Guerrero,Xochistlahuaca,,otra,0,0,1,0,0,0,0,,Sí,te_ido_con_plantas__ejem__muicle__peric_,1,0,0,0,Flores,es_una_t_cnica_antigua,,"Hilo vela,  telar de cintura",madre,1,0,0,0,0,0,0,0,,s__a_mis_hijas_o_hijos s__a_mis_nietas_o_nietos s__a_mis_sobrinas_o_sobrinos,0,1,1,1,0,0,0,0,,Huipiles,Servilleta,Manteles,Rebozo,Blusa,Blusa,Bata,Chalina,,,Boda,Primera comunión,Clausura,Bautizo,Confirmación,,,,,,,,,,,,Sí,Flor de cabalaza: fruta de la tierra,Flores de empasuchil,Águila de dos cabezas,,,https://kc.kobotoolbox.org/media/original?media_file=unescomx%2Fattachments%2F218b423bdd044378b9a7377d784ae06f%2Fb0f1ae2c-1ee5-4ea6-8f2a-24d12a9b9fa9%2F1000431015-15_58_21.jpg,,164,164-Mérida,161
15/10/2025,15/10/2025,15/10/2025,Mérida,mujer,35,Pertenezco a un colectivo familiar que realizamos varias técnicas tanto a mano como a máquina de pedal o motor,Bordado a mano,Punto de Cruz,,Xok bi chuy,Maya Yucateco,,Yucatán,Maní,,se_realiza_a_mano,1,0,0,0,0,0,0,,No,,0,0,0,0,,es_una_t_cnica_antigua,Que se parece a la piel de la serpiente de cascabel,"Tela de algodón o de lino, caneva de algodón estambre de colores, agujas, tijeras descosedor, hileras, aro.",madre,1,0,0,0,0,0,0,0,,s__a_mis_sobrinas_o_sobrinos,0,0,0,1,0,0,0,0,,Terno,Hipiles,Blusas,Servilletas,Pañales,Guallaveras,Solapas,Vestidos,Hipilitos para niñas,Pañales,Vaquerias,,Gremios,,Bautizos,,Bodas,,Quince años,,Eventos especiales,,,,,,Sí,Es un bordado prehispanico,Nombre en maya yucateco,Representa la piel de la serpiente de cascabel,,,,,165,165-Mérida,163
15/10/2025,15/10/2025,15/10/2025,Mérida,mujer,36,Pasar al stand por las otras técnicas,Bordado a mano,Bordado de Xochicuahuitl,,Xochicohuit,,Náhuatl,Puebla,Cuetzalan del Progreso,Cuetzalan,se_realiza_a_mano,1,0,0,0,0,0,0,,No,,0,0,0,0,,es_una_t_cnica_antigua,Son piezas ceremoni,Algodón,madre abuela,1,1,0,0,0,0,0,0,,s__a_mis_hijas_o_hijos,0,1,0,0,0,0,0,0,,En blusas,Fajas,,,,,,,,,,,,,,,,,,,,,,,,,Sí,El árbol de la vida,La flora y fauna de mi comunidad,,,,,,166,166-Mérida,164
15/10/2025,15/10/2025,15/10/2025,Mérida,mujer,46,,Bordado a máquina,Rayado,,La'ach ch'uuy,Maya Yucateco,,Yucatán,Teabo,,se_realiza_a_m_quina_de_pedal,0,1,0,0,0,0,0,,No,,0,0,0,0,,es_una_t_cnica_antigua,Lo utilizaba la gente de la clase trabajadora. Era utilizado en sus trajes regionales de gala,"Hilo de seda, hilo de algodón",madre,1,0,0,0,0,0,0,0,,no_la_he_ense_ado,1,0,0,0,0,0,0,0,,Prendas regionales de gala,Enmarcados,,,,,,,,,Vaquerías,,Cómo obsequio,,,,,,,,,,,,,,Sí,Rasgo identitario.,Conocimiento heredado,Reflejo de imágenes cotidianas e incluso imaginativa,,,https://kc.kobotoolbox.org/media/original?media_file=unescomx%2Fattachments%2F218b423bdd044378b9a7377d784ae06f%2F5247b40c-8dbc-445e-9ab9-0a9ea738639c%2F1000209970-16_0_3.jpg,,167,167-Mérida,165
15/10/2025,15/10/2025,15/10/2025,Mérida,mujer,45,,Telar de cintura,Brocado,,Jolobil,Tsotsil,,Chiapas,Larráinzar,,otra_1,0,0,1,0,1,0,0,,Sí,otro,0,0,0,1,No natural,es_una_t_cnica_antigua,Tradicional ya que esta parte cultural se hacen la vestimentas,"Algodón, lana, hilza",madre,1,0,0,0,0,0,0,0,,s__a_mis_hijas_o_hijos,0,1,0,0,0,0,0,0,,Huipiles tradicionales,Caminos de mesas,Rebozo,Fundas para cojines,Cosmetiqueras,,,,,,Mas que nada las piezas por ejemplo la huipil tradicional depende del cargo,,,,,,,,,,,,,,,,No,,,,,,https://kc.kobotoolbox.org/media/original?media_file=unescomx%2Fattachments%2F218b423bdd044378b9a7377d784ae06f%2F4fcd6db7-a70f-4656-90c6-7695df108c7f%2F1000061443-16_2_7.jpg,,168,168-Mérida,166
15/10/2025,15/10/2025,15/10/2025,Mérida,mujer,44,,Telar de cintura,Brocado,,Jolobil,Tsotsil,,Chiapas,Larráinzar,,otra,0,0,1,0,0,0,0,,No,,0,0,0,0,,es_una_t_cnica_antigua,Brocados en en telar de sintura generación en generación,Hilos de algodón,madre,1,0,0,0,0,0,0,0,,s__a_mis_hijas_o_hijos s__a_estudiantes si__a_otra_persona,0,1,0,0,0,1,1,0,Artesanas en las comunidades,Huipiles,Bolsas,Cosmetiqueras,Monederos,Tarjeteros,Blusas,,,,,Eventos,,,,,,,,,,,,,,,,Sí,Brocados tradicional de municipio,,,,,https://kc.kobotoolbox.org/media/original?media_file=unescomx%2Fattachments%2F218b423bdd044378b9a7377d784ae06f%2F067d6c47-b4ce-4219-9b68-d28e0c639a9c%2FScreenshot_20250926_115120_com.android.gallery3d-16_1_32.jpg,https://kc.kobotoolbox.org/media/original?media_file=unescomx%2Fattachments%2F218b423bdd044378b9a7377d784ae06f%2F067d6c47-b4ce-4219-9b68-d28e0c639a9c%2FVID_20210604_132926-16_2_10.mp4,169,169-Mérida,167
15/10/2025,15/10/2025,15/10/2025,Mérida,mujer,35,,Tejido a mano,Urdido,,"Hu,ac,bi ka,an.",Maya Yucateco,,Yucatán,Chumayel,,se_realiza_a_mano,1,0,0,0,0,0,0,,Sí,te_ido_con_plantas__ejem__muicle__peric_,1,0,0,0,,es_una_t_cnica_antigua,Que es una hamaca para descansar después de venir al campo y dormir en  las noches con nuestros hijos de nuestros antepasados,Primero necesito un barcidor una aguja llamado kaiche. Y los tubos o los madeos de nuestros hijos para realizar nuestra hamaca que tiene por nombre urdido de agua,madre,1,0,0,0,0,0,0,0,,s__a_mis_hijas_o_hijos s__a_mis_sobrinas_o_sobrinos s__a_una_pareja s__a_estudiantes si__a_otra_persona,0,1,0,1,1,1,1,0,,Hamacas de brazos normales y en hamacas con brazos tipo Reb,Silla mesedoras de hamaca,Banquillo de madera con hamaca,Columpio en hamaca,Collares en hamaca,"Hamaquitas para mascotas,",Doñas para el pelo,Pulceras,Atrapasueños,Hamacas con tejidos,Bodas,,Bautizo,,Cumpleaños,,Primera comunión,,Adornos para hoteles,,Restaurante,,,,,,Sí,La hamaca de nuestros ancestrales,,,,,https://kc.kobotoolbox.org/media/original?media_file=unescomx%2Fattachments%2F218b423bdd044378b9a7377d784ae06f%2Fef0bd022-a0d7-4a2b-821a-7fa83aeb1859%2FIMG_20251002_164725-15_58_15.jpg,,170,170-Mérida,168
15/10/2025,15/10/2025,15/10/2025,Mérida,mujer,29,,Telar de cintura,Brocado,,Táh.    (Telar de cintura) møn-,Chinanteco,,Oaxaca,San Juan Bautista Tlacoatzintepec,San Juan Bautista Tlacoatzintepec,otra otra_1,0,0,1,0,1,0,0,,No,,0,0,0,0,,es_una_t_cnica_antigua,,"Hilos, cinturon, machete, urdidor,",madre abuela t_a hermana,1,1,1,1,0,0,0,0,,si__a_otra_persona,0,0,0,0,0,0,1,0,Hermanas,Huipil de gala,Huipil antiguo,Huipil del diario,Blusas,Tiras para guayaberas,Bolsas,Cojines,Camino de mesa,Gorras,"Servilletas, manteles etc.",Casamiento,Fiestas o eventos importantes,"Eventos importantes, Fiestas",Evento religioso,Diario,Evento de la escuela,Cotidiano,,Cotidiano,,Cotidiano,,Cotidiano,,Cotidiano,,Sí,Flora,Fauna,Paisaje,Personalidad de una persona,Creatividad,https://kc.kobotoolbox.org/media/original?media_file=unescomx%2Fattachments%2F218b423bdd044378b9a7377d784ae06f%2F62701a05-289b-4027-9ff7-b32c11bae6e9%2F1000016713-16_4_32.jpg,,171,171-Mérida,169
15/10/2025,15/10/2025,15/10/2025,Mérida,mujer,51,,Telar de cintura,Telar de cintura,,Tejido en telar de cintura,,,Guerrero,Xochistlahuaca,,otra,0,0,1,0,0,0,0,,No,,0,0,0,0,,es_una_t_cnica_antigua,Desde hace mucho las personas conocen el color del hilo que es un color natural de la planta,Algodón natural,madre,1,0,0,0,0,0,0,0,,si__a_otra_persona,0,0,0,0,0,0,1,0,A muchas personas,Blusas,Huipiles,Manteles,Rebosos,,,,,,,Bodas,Huipiles,Bautizos,Ropa,,,,,,,,,,,,,Sí,Flores,Naturaleza,,,,,,172,172-Mérida,170
